,title,link,image,author,discount,publisher,pubdate,isbn,description
3,"K패션, 의류산업분야 주식투자 가이드",https://search.shopping.naver.com/book/catalog/32492651769,https://shopping-phinf.pstatic.net/main_3249265/32492651769.20230920071804.jpg,비티타임즈 편집부,27000,비티타임즈,20210426,9791163452621,"주식에 대한 책이 많이 있지만 챠트나 그래프등에 대한 분석 방법등 숲이 아닌 나무를 보는 방법을 가르쳐 주는 책이 다반사이다. 이에 반해 본 책은 산업별로 추천 기업들을 묶어서 산업에 대해 공부를 하고 기본용어부터 각 산업에 속한 회사에 대해 숙지하고 산업 전반을 이해하여 산업과 기업에 대해 분석할 수 있도록 하였다.

 나무가 아닌 숲을 보고 분석을 하면 큰 틀에서 기업분석과 투자에도 도움이 될 것이다.

 요즘 주식에 대한 열풍이 불면서 많은 분들이 주식투자와 주식공부에 뛰어들고 있는데, 어려운 주식시장에서 본 책을 통해 스스로 산업을 분석하고 기업을 선택하는데 도움이 되길 바란다.

 K패션,의류산업분야 주식투자가이드는 주식에 관한 기초부터, 패션,의류산업분야와 관련된 용어, 산업전망, 관련 추천 기업에 대해 소개하였다."
4,핀테크 산업분야 주식투자 가이드,https://search.shopping.naver.com/book/catalog/32494066736,https://shopping-phinf.pstatic.net/main_3249406/32494066736.20230920073112.jpg,비티타임즈 편집부,27000,비티타임즈,20210426,9791163452614,"주식에 대한 책이 많이 있지만 챠트나 그래프등에 대한 분석 방법등 숲이 아닌 나무를 보는 방법을 가르쳐 주는 책이 다반사이다. 이에 반해 본 책은 산업별로 추천 기업들을 묶어서 산업에 대해 공부를 하고 기본용어부터 각 산업에 속한 회사에 대해 숙지하고 산업 전반을 이해하여 산업과 기업에 대해 분석할 수 있도록 하였다.

 나무가 아닌 숲을 보고 분석을 하면 큰 틀에서 기업분석과 투자에도 도움이 될 것이다.

 요즘 주식에 대한 열풍이 불면서 많은 분들이 주식투자와 주식공부에 뛰어들고 있는데, 어려운 주식시장에서 본 책을 통해 스스로 산업을 분석하고 기업을 선택하는데 도움이 되길 바란다.

 핀테크 산업분야 주식투자가이드는 주식에 관한 기초부터, 핀테크 산업 분야와 관련된 용어, 산업전망, 관련 추천 기업에 대해 소개하였다."
5,생체인식 산업분야 주식투자가이드,https://search.shopping.naver.com/book/catalog/32466656519,https://shopping-phinf.pstatic.net/main_3246665/32466656519.20221019120126.jpg,비티타임즈 편집부,27000,비티타임즈,20210419,9791163452584,"주식에 대한 책이 많이 있지만 챠트나 그래프등에 대한 분석 방법등 숲이 아닌 나무를 보는 방법을 가르쳐 주는 책이 다반사이다. 이에 반해 본 책은 산업별로 추천 기업들을 묶어서 산업에 대해 공부를 하고 기본용어부터 각 산업에 속한 회사에 대해 숙지하고 산업 전반을 이해하여 산업과 기업에 대해 분석할 수 있도록 하였다.

 나무가 아닌 숲을 보고 분석을 하면 큰 틀에서 기업분석과 투자에도 도움이 될 것이다.

 요즘 주식에 대한 열풍이 불면서 많은 분들이 주식투자와 주식공부에 뛰어들고 있는데, 어려운 주식시장에서 본 책을 통해 스스로 산업을 분석하고 기업을 선택하는데 도움이 되길 바란다.

 생체인식 산업분야 주식투자가이드는 주식에 관한 기초부터, 생체인식 분야와 관련된 산업과 용어, 관련 추천 기업에 대해 소개하였다."
6,주린이도 평생 월급 받는 주식 투자 시스템 (가난한 사람들은 황금을 사고 부자들은 황금알을 낳는 거위를 산다),https://search.shopping.naver.com/book/catalog/32557643624,https://shopping-phinf.pstatic.net/main_3255764/32557643624.20230606110808.jpg,김우창,15300,한국경제신문i,20220526,9788947548212,"평생 월급이 보장되는 주식 투자 시스템과
월급을 두 번 받는 저자의 특급 노하우를 담은 책

만약 황금을 얻고 싶다면 두 가지 방법이 있다. 한 가지는 열심히 직장을 다니고, 사업을 하고, 노동을 해서 황금을 얻는 방법이다. 또 한 가지는 황금알을 낳는 거위를 키우고, 그 거위를 통해 매달 황금을 얻는 것이다. 어느 쪽이 더 현명한 선택인가? 당연히 황금을 낳는 거위를 키우는 쪽일 것이다. 하지만 대부분은 열심히 직장을 다니며 돈을 벌어 황금을 사는 일에 익숙해져 있다. 그런 당신에게 일하지 않아도 수입이 들어오는, 그야말로 황글알을 낳는 거위와 같은 시스템이 있다고 하면 믿을 수 있을까? 이 책의 저자는 우리가 알지 못할 뿐, 그런 시스템은 분명 존재한다고 말한다. 잘 구축해둔 주식 시스템으로 한 달에 월급을 한 번 더 받으면서, 소득이 없어지는 날이 와도 평생 월급을 받을 수 있는, 저자가 직접 실천하고 있는 특별한 노하우를 알려준다. 특히, 주식을 시작한 지 얼마 안 된 ‘주린이’들이 주식 투자를 통해 성공하는 법을 알려주는 데 포커스를 맞췄기 때문에 어렵지 않게 읽으면서 주식 시장의 흐름도 파악할 수 있다. 그 외에도 직장인, 노후가 걱정인 퇴직자와 퇴직 예정자들, 육아로 직장을 못 다니는 주부들, 주식으로 실패했던 경험이 있는 분들이 주식을 통해 꾸준한 소득을 정기적으로 얻을 수 있는 방법만 선별해 핵심만 알려준다. 

지금 돈 많은 사람이 아니라
평생 월급 받는 사람이 진짜 부자다
 
이 책에는 단기간에 큰 수익을 주는 방법은 없다. 대신 평생 월급을 받을 수 있는 착실한 시스템을 소개해준다. 저자는 단기간에 대박 종목을 사서 큰 시세차익을 얻는 방법은 거의 도박과 같다고 말한다. 그런 투자는 한두 번은 성공하겠지만 나중에는 큰돈을 잃을 것이 뻔하기 때문이다. 저자는 지금 돈 많은 사람이 아니라, 정기적인 주식 투자 수익으로 평생 생활비 걱정 없이 사는 사람이 진짜 부자라고 말하며, 총 다섯 파트에 걸쳐 진짜 부자가 되는 방법을 소개한다. 첫째, ‘주식의 ‘주’도 모르는데 평생 월급 받을 수 있나요’에서는 평생 월급 시스템이 가능한 원리에 대해 소개하고, 둘째, ‘투자만 하면 손실 나는데 좋은 매매법이 있나요’에서는 주봉돌파, 월봉 매매법 등 차트를 보면서 수익을 내는 투자에 대한 실전 분석을 해본다. 셋째, ‘국민연금처럼 평생 매달 300만 원 받는 매매 비법들’에서는 중, 장기 투자 비법과 종목 선택 노하우를 알아보고, 넷째, ‘천재들에게 배우는 투자 전략’에서는 슈퍼개미, 세계적인 머니 코치 등 투자에 성공한 사람들의 사례를 통해 투자 전략을 살펴본다. 마지막으로 ‘지금 당장, 평생 꺼내 쓰는 현금인출기를 만들자’에서는 100종목 투자법과 평생 월급 5,000만 원 목표 설정을 위한 준비 등에 대해 구체적으로 알아본다."
7,이채원의 가치투자 (가슴 뛰는 기업을 찾아서),https://search.shopping.naver.com/book/catalog/32483310373,https://shopping-phinf.pstatic.net/main_3248331/32483310373.20221019143337.jpg,이채원^이상건,13500,이콘,20161205,9788990831316,"대한민국 가치투자의 일인자로 꼽히며 '한국의 워런 버핏'으로까지 불리는 한국밸류자산운용의 이채원 전무와 베스트셀러 작가 이상건 씨가 공동으로 쓴 책으로, 본인이 직접 투자했던 투자 경험과 사례를 바탕으로 가치투자를 길잡이해준다.



저자가 증권사에 입사하여 가치투자에 눈을 떠가는 과정과 저자의 투자 경험을 바탕으로 구체적인 사례를 들어가며 가치투자를 여러 각도로 조명하는 내용, 그리고 가치투자는 어떤 마음가짐과 태도를 가지고 있어야 하는지, 가치투자에 대한 오해와 그 진실은 무엇인지를 그리고 있다.



그런데 이런 이야기를 전달하는 방식이 여느 주식 투자 책들과는 다르다. 기존의 책들이 '이런 방법이 옳으니 이렇게 하라'는 식이라면, 이 책은 그저 저자 본인의 투자 경험을 적절한 분류 아래 알기 쉽고 소상하게 전달하고 있을 뿐이다. 게다가 투자 사례도 종목명, 차트 등과 함께 단편적인 내용을 기술하는 것에 그치지 않고 투자 아이디어에서 투자의 성패에 이르는 과정을 이야기 속에 재미있게 담아내고 있다."
8,"AI 퍼스트 (투자의 미래, 인공지능이 답이다)",https://search.shopping.naver.com/book/catalog/32436121783,https://shopping-phinf.pstatic.net/main_3243612/32436121783.20230523085739.jpg,서재영,15300,더블북,20210615,9791191194128,"지금 전 세계의 투자와 돈이 몰리는 곳은?
향후 30년을 좌우할 게임 체인저?
AI 기업 얼마나 알고 있는가!

전 세계의 돈이 인공지능에 몰리고 있다. 이 시대, 부를 거머쥐려면 인공지능을 제대로 알아야 한다는 메시지를 담은 『AI 퍼스트』가 출간됐다. 이 책은 우리나라 증권계 연봉킹 서재영 상무가 국내 21개 AI 기업을 심층 분석하고, 국내외 상장 또는 상장 예정인 150여 개 기업을 소개한 책이다. 

왜 인공지능일까? 이미 서비스나 상품에 인공지능을 장착한 기업과 그렇지 않은 기업의 생존 여부가 갈리고 있기 때문이다. 음식, 패션 같은 소비재부터 의료, 금융, 광고까지 인공지능을 일찍 장착한 기업은 현재 엄청난 성장을 하며, 투자를 받아내고 있다. 이 책은 뛰어난 인공지능을 장착해 성장한 기업들의 현장을 직접 찾아 심도 있게 소개한다.

주식투자해서 돈 벌었다는 기사는 넘치는데 막상 수익률이 평균보다 못할 때, 한 가지 궁금증이 든다. 대체 돈 버는 사람은 어디에 투자해서 돈을 벌까? 큰 이익을 얻는 사람은 인사이트가 있는 사람이다. 그들은 시대를 통찰하고 미래를 변화시킬 산업을 알아본다. 

그렇다고 복잡하게 세상을 들여다볼 필요는 없다. 이 세상 부자들이 어디에다 돈을 집중하고 있는지만 보면 된다. 이를테면 선다 피차이 구글 CEO가 요즘 어디에다 돈을 쓰고 있지를 살펴보면 된다. 선다 피차이는 직원들에게 보낸 메일에서 ‘모바일 퍼스트 시대에서 AI 퍼스트 시대’로의 전환을 예고했기 때문이다. 그는 세계경제포럼 콘퍼런스에서 “인공지능은 우리 인류가 작업하고 있는 가장 영향력이 큰 것 중 하나며 그것은 불이나 전기보다 더 영향력이 심대하다”라고 말하면서 다시금 AI 퍼스트 시대를 강조했다. 

만약 다가올 미래, 무엇으로 먹고살지, 어디에 투자해야 할지 감이 잡히지 않는다면 이 책을 펼쳐보자. 세계 최고 기업들과 투자자들이 인공지능에 집중하고 있는 데는 다 이유가 있다."
9,기업은 누구의 것인가 (한국 기업에 거버넌스의 기본을 묻다),https://search.shopping.naver.com/book/catalog/32454325114,https://shopping-phinf.pstatic.net/main_3245432/32454325114.20230912083443.jpg,이관휘,14400,21세기북스,20220427,9788950900564,"서울대 가지 않아도 들을 수 있는 명강의, ‘서가명강’
재무경제학으로 읽는 시장과 기업의 본질

대한민국 최고의 명품 강의를 책으로 만난다! 현직 서울대 교수진의 강의를 엄선한 ‘서가명강(서울대 가지 않아도 들을 수 있는 명강의)’ 시리즈의 스물세 번째 책이 출간됐다. 역사, 철학, 과학, 의학, 예술 등 각 분야 최고의 서울대 교수진들의 명강의를 책으로 옮긴 서가명강 시리즈는 독자들에게 지식의 확장과 배움의 기쁨을 선사하고 있다. 
『기업은 누구의 것인가』는 전 세계 주식시장을 대상으로 주식가격 결정 등 투자론을 연구하는 서울대학교 경영대학 이관휘 교수가 쓴 책으로, 주식시장의 핵심이자 기본인 ‘기업지배구조’에 대해 날카롭고 명쾌하게 분석하고 있다. 이 책은 재무경제학의 오래된 질문인 ‘기업의 주인은 누구인가?’에 대한 질문을 시작으로 기업의 골자와 경영자·주주·채권자 등 기업을 둘러싼 이들의 이해관계와 셈법을 속속들이 조명하고 있어, 투자자들이 기업을 투자할 때 무엇을 보고 판단할지 길라잡이가 되어줄 것이다. 

☞ '서가명강'을 유튜브 · 강연 · 팟캐스트로 만나보세요! 
▶ 강연 book21.com/lecture
▶ 유튜브 youtube.com/서가명강
▶ 오디오클립 audioclip.naver.com/channels/345
▶ 팟빵 www.podbbang.com/ch/14808
▶ 포스트 post.naver.com/21c_sgmk "
0,한 권으로 끝내는 테마주 투자 (무관심에 사서 뜨거운 관심에 팔아라!),https://search.shopping.naver.com/book/catalog/32487705727,https://shopping-phinf.pstatic.net/main_3248770/32487705727.20230711112659.jpg,박민수,19800,길벗,20200415,9791165211080,"기본 지식부터 투자 전략, 종목 분석까지
왕초보를 위한 테마주 교과서!

그대로 따라만 하면 절대 잃지 않는 불패 투자법!
ㆍ 빠르게 수익 내는 테마주와 안전한 가치투자의 장점을 합쳤다!
ㆍ ‘신호등 종목 분석표’를 이용하면 쉽고 빠르게 종목 분석을 끝낼 수 있다!
ㆍ 과거 경험치를 통해 매수·매도 디데이를 정확하게 안다!"
1,주식투자 할 때와 멈출 때 (5개의 핵심 키워드가 이끄는 시세와 추세의 절대 원칙),https://search.shopping.naver.com/book/catalog/33867988306,https://shopping-phinf.pstatic.net/main_3386798/33867988306.20230117164811.jpg,신성호,22500,캐피털북스,20220801,9791197850011,"주식시장 반세기의 역사를 완전 해부하여 
시세와 추세를 이끄는 핵심 5개 요체의 
역동적 원리를 파헤친 최고의 역작!

‘주식투자는 할 때와 멈출 때가 있다!’ 저자가 이 책에서 주식투자자들에게 전하고 싶은 핵심 결론이다. 지난 주식시장의 반세기 역사와 종합주가지수의 흐름을 되돌아본다면 장기투자가 결코 현명한 투자 전략이 아니었음을 발견하게 된다. 이 사실은 분명 주식을 매도했어야 했던 시점이 있었다는 사실을 말해 주고 있다. 여기서 중요한 포인트는 2가지다. 첫째, 왜 장기투자의 성적이 신통치 않았을까? 저자는 그 원인에 대해 자세하게 설명한다. 둘째, 더욱 중요한 점은 주가의 정ㆍ저점을 알려주는 징후들이 분명히 존재했고, 지금도 그 원칙은 크게 다를 게 없다는 사실이다. 주가의 정ㆍ저점 징후를 알려주는, 그러니까 추세의 전환 시점을 파악할 수 있다면 주식투자에서 좋은 성적을 얻을 수 있지 않을까?   
   저자는 이 책에서 그 시세와 추세의 전환 타이밍을 알려주는 기업 이익, 금리, 고객예탁금, 주가의 기술적 추이, 종목선정 성향 등 5개의 핵심적 요체의 역동적 원리에 대해 상세하게 설명한다. 그런 측면에서 이 책은 기존에 발간된 주식투자 책들과는 전혀 다르다. 기존의 책들은 주가를 금융이나 실물경기의 한 변수로 설명하거나 단순히 기술적 분석 또는 테마주 투자 관련 방법론적 소개가 주류를 이루었던 반면, 이 책은 실물경제의 최종 결과인 기업의 이익과 금융의 구체적 실체인 금리가 주가에 미치는 영향을 동시에 다루고 있다. 구체적으로 시세와 추세를 지배하는 기업 이익, 금리, 고객예탁금, 주가의 기술적 추이, 종목선정 성향 등 5개의 핵심 요체들이 어떻게 서로 맞물리면서 시세와 추세를 분출하고 시장을 흔드는지 역사적 사례를 통해 제시하고 있다."
2,주식투자 절대공식 9 (주린이도 따라하면 반드시 수익이 나는),https://search.shopping.naver.com/book/catalog/32440678802,https://shopping-phinf.pstatic.net/main_3244067/32440678802.20221019135942.jpg,송영욱,14850,스몰빅인사이트,20210329,9791187165910,"주식투자를 감感이나 운에 맞기지 마라!
분명한 공식으로 반드시 이기는 투자를 해라!

당신이 주식투자를 하는 궁극적 목적은 수익을 내는 것이다. 그런데 대부분의 투자자들은 제대로 된 기준도 원칙도 없이 주식에 뛰어들었다가 손해를 보고 만다. 수익이 나는 주식투자를 하고 싶다면 자신이 정확히 얼마를 벌고 싶은지, 얼마 동안 투자할 것인지, 어떤 기준으로 사고팔 것인지에 대해 명확한 기준을 가져야 한다. 이 책은 그 기준을 세우기 위해 필요한 주식투자 절대공식을 9가지로 명쾌하게 정리했다. 20년 경력의 투자자이자 금융인들도 배우는 주식전문가인 저자는 주식투자로 돈을 벌기 위해서는 명확한 매매기준을 정해 실천하는 것이 가장 중요하다고 말하며, 그러기 위해선 그 기준이 쉽고 단순해야 한다고 강조한다. 그래서 이 책에서는 좋은 종목을 선정하고 적절한 매매 타이밍을 잡는 방법을 9가지 공식으로 쉽고 간단하게 제시하고 있다. 9가지 절대공식만 머릿속에 담아두면 소문에 휘둘려 사고팔다 손해 보는 일은 없을 것이다. 이 책은 초보자는 물론 주식투자 경험은 많지만 실제 매매에서 제대로 수익을 내지 못하고 있는 사람들에게도 큰 도움이 될 수 있다. 전쟁터 같은 주식시장에서 개미투자자들이 안정적이고 확실한 수익을 내기 위한 천금 같은 방법을 이 책을 통해 배울 수 있을 것이다."
3,타이밍의 마법사들 (위대한 트레이더 55인의 성공 법칙),https://search.shopping.naver.com/book/catalog/32465578505,https://shopping-phinf.pstatic.net/main_3246557/32465578505.20230927071501.jpg,잭 슈웨거,13950,이레미디어,20201230,9791188279982,"아마존 투자 부분 베스트셀러
전설적인 투자자 55인의 성공 법칙

지난 30년 동안 월스트리트의 전설적인 투자자들을 인터뷰했고, 그 탐구 과정을 《시장의 마법사들》 시리즈 총 4편, 2,000여 쪽에 정리했던 잭 슈웨거의 신간이 출간됐다. 세계 최고의 트레이더 60여 명과 인터뷰하며 얻은 교훈에서 55인의 핵심만을 뽑아 《타이밍의 마법사들》에 담아냈다. 
장마다 전설적인 투자자들의 명언이 수록되어 있다. 55인의 명언과 함께 시장에서 성공할 수 있었던 비결을 비교하며 읽다 보면, 독자 스스로 자신에게 맞는 원칙과 전략을 개발할 수 있다. 이미 《시장의 마법사들》 시리즈 4권을 본 독자라면 이 책을 읽는 동안 시리즈 전체를 다시 보는 느낌을 받을 것이다. 아직 시리즈를 보지 못한 독자라도 이 책을 통해 4권의 이야기를 전부 훑어볼 수 있다는 장점이 있다. 한 치 앞을 내다볼 수 없는 지금의 주식시장 상황이야말로 주식투자의 기본과 원칙으로 돌아가기 위한 최적의 타이밍이다. 그 기본과 원칙으로 돌아가는 해답이 바로 이 책에 있다."
4,돈의 물결 (장이 무너져도 솟아날 종목은 있다),https://search.shopping.naver.com/book/catalog/32503852690,https://shopping-phinf.pstatic.net/main_3250385/32503852690.20221019134314.jpg,박제연,14850,베가북스,20210315,9791190242769,"구독자 20만 명, 누적조회 약 2,000만 회
머니클럽 박제연의 투자 인사이트!

2021년, 돈의 흐름이 바뀌고 있다!
주식 시장의 사이클을 읽어라

주식 시장은 끊임없이 움직인다. 우리 모두 아는 사실이다. 중요한 것은 이 시장에 언제 올라타야 하는지다. 그 핵심은 주식의 숨겨진 패턴을 읽는 데 있다. 우리에게 영향을 주는 수많은 것들 속에서 어떤 것을 따라야 투자 승률을 높일 수 있는지 분별력을 키워야 한다.

지난 1년간 분위기를 타면서 많은 투자자가 상승의 기쁨을 맛봤다면, 2021년부터는 투자 관점과 능력에 따라 개인투자자들의 희비가 수면 위로 적나라하게 드러날 것이다.

‘주린이’부터 ‘동학 개미’까지 개인투자자들이 모두 투자의 정도를 걸었으면 하는 마음을 담은 책 『돈의 물결』은 놓치기 쉬운 주식 기초부터 세상 물정이 시장에 끼치는 영향, 과거 경제 이슈들과 시장의 관계, 시장 불확실성 대책까지 4가지 대주제로 구성돼 있다. 흔히 말하는 ‘마법의 차트 기법’ 없이도 주식 시장의 큰 흐름을 보고 단편적인 투자에서 벗어나 장기적인 시각을 키울 수 있을 것이다. 저자가 바라는 대로 모든 투자자가 자신들의 피, 땀, 눈물로 이루어진 소중한 자산을 잘 지켜내기를 바란다."
5,워런 버핏처럼 적정주가 구하는 법,https://search.shopping.naver.com/book/catalog/32441515650,https://shopping-phinf.pstatic.net/main_3244151/32441515650.20221019120525.jpg,이은원,16200,부크온,20160930,9788994491516,『워런 버핏처럼 적정주가 구하는 법』은 얼마에 사야 싸게 사는 것일까? 또 얼마에 팔아야 수익을 극대화하면서 잘 파는 것일까? 이 책은 이런 물음에 대한 구체적이고 객관적인 해답서이다. 워런 버핏이 실제로 투자한 사례를 집중 조명한 후 한국주식에도 적용 가능하다는 것을 보여주기 위해 실제 적용사례를 보여주고 있다.
6,이것이 진짜 주식이다 (2030 미래 성장 가치주 발굴기법),https://search.shopping.naver.com/book/catalog/32485698837,https://shopping-phinf.pstatic.net/main_3248569/32485698837.20230919122904.jpg,이상우,18000,여의도책방,20210614,9791197074653,"이제는 진짜 주식을 아는 프로만 수익을 내는 시장이다!

대한민국 최고의 차트 전문서이자 스테디셀러인 『주식차트 절대비기 300선!』의 저자가 공매도와 세력을 이기는 진짜 주식의 세계를 소개한다. 팬데믹 이후 변화한 투자 패러다임에 대한 탁월한 인사이트와 함께 가치주와 성장주의 차이와 매매 타이밍을 명확히 제시하고, 중장기 투자와 함께 단기 투자를 병행해야 할 명분과 실패하지 않는 15/60 단기 투자 기법까지 공개한다. 

저자는 흔들리는 것은 진짜가 아니라고 단언하며 어떤 상황에서도 흔들리지 않는 진짜 주식의 세계를 말하고 있다. 투자자의 멘탈 관리부터 흔히 반대로 알고 있던 호가창 분석하기, 필수 지표 해석 등 단단한 기본을 짚어주고 있다. 또한 실전편에서는 총 28가지 핵심 매매기법을 선보인다. 성장주 매매기법 10가지, 가치주 매매기법 10가지, 종합 매매기법 8가지는 글로벌 탑티어 기업을 보유한 대한민국에 찾아올 투자의 기회를 놓치지 않도록 도와줄 것이다. 마지막 부록에는 2030년까지 유망한 14개 섹터의 전망과 분석, 각 유망 섹터에 속하는 종목을 소개해 투자 종목 선정에 도움이 되고자 했다."
7,주식가치투자 정석 시리즈: 농생명분야(2021) (2021 개정판),https://search.shopping.naver.com/book/catalog/32498099628,https://shopping-phinf.pstatic.net/main_3249809/32498099628.20221019152406.jpg,비티타임즈 편집부,23400,비티타임즈,20210215,9791163452188,"『주식가치투자 정석 시리즈: 농생명분야(2021)』은 〈농업 관련 산업이란〉, 〈농업 관련 산업의 종류〉, 〈등기소에 제공하여야 하는 첨부정보〉, 〈농업 관련 산업 응용분야〉, 〈농업관련 산업 시장〉, 〈농업 관련 산업 추천 기업 및 분석〉을 수록하고 있는 책이다."
