,title,originallink,link,description,pubDate
2,"미래에셋자산운용, S&amp;P동일가중투자·반도체TOP10레버리지 ETF 상장",http://www.smedaily.co.kr/news/articleView.html?idxno=298237,http://www.smedaily.co.kr/news/articleView.html?idxno=298237,또한 중소형주 비중이 상대적으로 높아 다가올 <b>금리</b> 인하 사이클에 효과적인 투자 전략이다. TIGER 반도체TOP10레버리지 ETF는 국내 최초 반도체 섹터에 투자하는 레버리지 ETF다. 국내 대표 최대 반도체 ETF인... ,"Tue, 23 Jul 2024 09:00:00 +0900"
3,[채권뷰] 미국 국채 10년물 <b>금리</b> 4.25%…한국 3.15%,https://www.etoday.co.kr/news/view/2382880,https://www.etoday.co.kr/news/view/2382880,이투데이=박정호 기자 |,"Tue, 23 Jul 2024 08:58:00 +0900"
4,"최상목 부총리 &quot;시니어 레지던스 공급 확대, 수능 원서 온라인 작성&quot;",https://news.heraldcorp.com/view.php?ud=20240723050096,https://n.news.naver.com/mnews/article/016/0002339210?sid=101,"저소득 근로자 생활안정자금의 융자조건은 <b>금리</b> 1.5%, 한도 200만~2000만원, 1년 거치 3~4년 상환 등이다. 최 부총리는 “적극적 노동시장 정책 인프라도 지속 확충하겠다”며 “이번주 발표할 세법개정안을 통해... ","Tue, 23 Jul 2024 08:58:00 +0900"
5,당국 PF 관리 나서도…서울 부동산 ‘꿈틀’하자 PF대출채권 발행 증가 전환,https://www.etoday.co.kr/news/view/2382892,https://www.etoday.co.kr/news/view/2382892,"유동화증권 발행 증가 폭은 발행시장 <b>금리</b> 안정화로 인해 크지 않았다. 주목할 부분은 부동산 PF대출채권이다. 유동화증권 종목별로 보면 주택저당증권(MBS, -42.7%), 오토론·소비자금융채권(-42.3%), 기업매출채권(0.5... ","Tue, 23 Jul 2024 08:58:00 +0900"
6,"뉴욕증시, 바이든 사퇴에도 저가 매수로 반등…국제유가, WTI 사흘 연속 하락",https://www.asiatime.co.kr/article/20240723500022,https://www.asiatime.co.kr/article/20240723500022,(Fed·연준)의 <b>금리</b>인하 기대감은 투자자들에게 다소 희망을 줬다&quot;고 말했다. 이날 주요 기술주 중에선... 시카고상품거래소(CME) 페드워치툴에 따르면 연방기금<b>금리</b> 선물시장은 이날 마감 무렵 9월 <b>금리</b> 인하 확률을 94.2... ,"Tue, 23 Jul 2024 08:58:00 +0900"
7,"핀다, 기업은행과 대출상품 중개…업계 최다 71개 금융사 제휴",http://www.edaily.co.kr/news/newspath.asp?newsid=01577686638957472,https://n.news.naver.com/mnews/article/018/0005795430?sid=101,수준의 <b>금리</b>를 제공하는 IBK기업은행의 신용대출 상품인 ‘i-ONE 직장인스마트론’을 입점시키며 가장 많은 금융사의 대출 상품을 비교하는 플랫폼의 입지를 굳혔다. 핀다와 제휴한 1금융권도 10곳으로 늘며 고<b>금리</b>... ,"Tue, 23 Jul 2024 08:56:00 +0900"
8,[초동시각]정책은 '권한'이 아닌 '책임'입니다,https://view.asiae.co.kr/article/2024072219192208748,https://n.news.naver.com/mnews/article/277/0005449284?sid=110,기준<b>금리</b>를 400bp(1bp=0.01%)나 끌어올려 전 세계 경제전문가들로부터 ‘큰 키만큼 <b>금리</b>를 올린 인물’로 회자됐던 ‘인플레이션 파이터(inflation fighter)’. 밀턴 프리드먼의 통화 정책론에 비판적이었으며 오늘날... ,"Tue, 23 Jul 2024 08:55:00 +0900"
9,&quot;끌어다 쓴 돈이…이렇게까지 될 줄 몰랐다&quot; 빚더미에 '적자인생' 사장님[머니...,https://news.heraldcorp.com/view.php?ud=20240723050092,https://n.news.naver.com/mnews/article/016/0002339206?sid=101,빚으로 버틴 코로나19 위기가 지나고 고<b>금리</b> 시대가 도래하자 막대한 이자 부담을 버티지 못한 이들이... 이들은 <b>금리</b>가 내리고 물가가 낮아진다고 사정이 저절로 좋아지지 않는다는 사실을 체감하고 있었다. 하지만... ,"Tue, 23 Jul 2024 08:55:00 +0900"
0,&quot;주식 강세장 끝났다…올해 말부터 경기 후퇴해 S&amp;P 32% 하락&quot;,https://news.einfomax.co.kr/news/articleView.html?idxno=4318133,https://news.einfomax.co.kr/news/articleView.html?idxno=4318133,"BCA리서치의 분석에 따르면, 연준의 <b>금리</b> 인하 시기와 경기 후퇴 진입은 역사적으로 관련이 있다. 그는 &quot;경기 후퇴는 일반적으로 연준이 <b>금리</b> 인하를 시작한 시점으로부터 얼마 지나지 않아 시작된다&quot;며 &quot;연준이 <b>금리</b>를... ","Tue, 23 Jul 2024 08:52:00 +0900"
1,"뱅크몰, 온·오프라인 연계 주담대 비교 서비스 오픈",https://www.kbanker.co.kr/news/articleView.html?idxno=215574,https://www.kbanker.co.kr/news/articleView.html?idxno=215574,"추가적인 내용 입력 없이 기본적인 정보만으로 대출 모집인에게 대출 <b>금리</b> 및 금액, 중도상환수수료 등 정보를 제안받을 수 있다. 앞서 뱅크몰은 지난 2022년 국내 최초로 모집인 연계 서비스를 시범 운영한 바 있으며... ","Tue, 23 Jul 2024 08:52:00 +0900"
2,&quot;벌써 곡소리?&quot;…삼전·SK하이닉스 빼면 2분기 실적 전망 '우울',https://www.hankyung.com/article/2024072318356,https://n.news.naver.com/mnews/article/015/0005013054?sid=101,서상영 미래에셋증권 연구원은 &quot;최근 코스피 약세에도 불구하고 <b>금리</b>인하 가능성에 달러화 약세를 기대하는 지표 결과 등을 감안해보면 주식시장이 지속적인 하락을 보일 가능성은 크지 않다&quot;며 &quot;당분간 종목별... ,"Tue, 23 Jul 2024 08:50:00 +0900"
3,&quot;할인분양자 입주 자격 없어&quot; 미분양 폭탄에 갈등,https://www.moneys.co.kr/article/2024072215260515407,https://n.news.naver.com/mnews/article/417/0001016075?sid=101,<b>금리</b> 인하처럼 뚜렷한 모멘텀 없이 미분양이 해결될 기미가 없는 만큼 할인분양 갈등도 지속될 전망이다. 부동산 침체기마다 같은 문제가 반복되고 지방 미분양 심화로 갈등이 증폭될 것으로 보인다. 전문가들은 미분양... ,"Tue, 23 Jul 2024 08:50:00 +0900"
4,"국제유가 하락, 중국 경제 부진과 바이든 대선후보 사퇴 따른 불확실성 겹쳐",https://www.businesspost.co.kr/BP?command=article_view&num=359772,https://www.businesspost.co.kr/BP?command=article_view&num=359772,"대출우대<b>금리</b> 인하를 발표했으나 최근 중국 경제지표 부진에 따른 수요 불안이 이어지며 하락했다&quot;고 말했다. 중국인민은행은 22일 공지를 통해 일반 대출 역할을 하는 1년물 대출우대<b>금리</b>를 3.35%로, 주택담보대출... ","Tue, 23 Jul 2024 08:46:00 +0900"
5,"(종합) '신한은행·신한카드' 신한 SOL페이(신한플레이), 7월 23일 '쏠퀴즈(쏠...",http://www.bizwnews.com/news/articleView.html?idxno=86021,http://www.bizwnews.com/news/articleView.html?idxno=86021,사진=신한 SOL페이 이와 별도로 출제되고 있는 23일 자 '신한 SOL페이(구 신한플레이) 퀴즈팡팡(오늘의 OX퀴즈)' 문제 &quot;&quot;포인트를 입금할 수록 우대<b>금리</b>가 올라가는 신한 슈퍼SOL 포인트 적금은 선착순 ㅇㅇ만좌... ,"Tue, 23 Jul 2024 08:46:00 +0900"
6,돈 푸는 중국... 동결 예상 깨고 <b>금리</b> 인하,https://weeklytrade.co.kr/news/view.html?section=1&category=136&item=&no=92342,https://weeklytrade.co.kr/news/view.html?section=1&category=136&item=&no=92342,▲위안화[연합뉴스 자료사진]중국이 시장 기대치를 밑돈 2분기 경제성장률과 중국공산당의 부동산·내수 활성화 의지에 대한 비판적 평가 속에 '사실상의 기준<b>금리</b>'인 대출우대<b>금리</b>(LPR)를 5개월 만에 인하하며... ,"Tue, 23 Jul 2024 08:44:00 +0900"
7,"신한은행, 중소기업 위한 ‘디지털 신용보증 팩토링’ 상품 출시",https://weekly.cnbnews.com/news/article.html?no=162273,https://weekly.cnbnews.com/news/article.html?no=162273,"낮은 <b>금리</b>가 적용되며 구매기업에 대한 신용평가도 생략할 수 있게 돼 절차가 간편해졌다. 신한은행 관계자는 “테크핀레이팅스, 서울보증보험과의 협업을 통해 기업들이 비대면 플랫폼 상에서 편리하게 낮은 <b>금리</b>로... ","Tue, 23 Jul 2024 08:42:00 +0900"
8,[박정식의 국내 주식시황] 글로벌 증시 반등 속 외국인 순매수 재유입으로 동...,https://www.newsquest.co.kr/news/articleView.html?idxno=227888,https://www.newsquest.co.kr/news/articleView.html?idxno=227888,지표가 <b>금리</b>인하 기대감을 키워주는 역할을 해야한다. 이미 시장에서는 9월 FOMC에서 <b>금리</b>인하 기대감을 키우고 있고 시카고상품거래소(CME) 페드워치에 따르면 전일 장 마감 부근에서 Fed가 9월 FOMC에서 <b>금리</b>를 0.25%포인트... ,"Tue, 23 Jul 2024 08:42:00 +0900"
9,"[토큰포스트 브리핑] 외신 &quot;美 SEC, 이더리움 현물 ETF 거래 승인&quot; 外",https://www.tokenpost.kr/article-188240,https://www.tokenpost.kr/article-188240,"웰스파고 &quot;미 연준, 이달 <b>금리</b> 인하 추진 예상&quot; 외신에 따르면 월스트리트 대형 투자은행 웰스파고가 보고서를 발표, 이번달 예상대로 연방준비제도(Fed·연준)가 <b>금리</b>를 인하할 것으로 예상한다고 전했다.... ","Tue, 23 Jul 2024 08:42:00 +0900"
0,"동반위, 전력거래소·농어촌공사와 협력사 ESG 경영지원나서",http://www.metroseoul.co.kr/article/20240723500011,http://www.metroseoul.co.kr/article/20240723500011,"확인서를 보유한 협력사는 ▲<b>금리</b>우대(신한·기업·경남·국민은행) ▲해외진출 지원사업 우대(KOTRA, KOICA) ▲환경·에너지 기술지원(한국에너지기술연구원) 등의 인센티브를 받을 수 있다. 동반위 오영교 위원장은... ","Tue, 23 Jul 2024 08:42:00 +0900"
1,음성군 미분양관리지역 해제 '청신호',https://www.gukjenews.com/news/articleView.html?idxno=3049732,https://www.gukjenews.com/news/articleView.html?idxno=3049732,"한국은행이 6월 25일 발표한 '소비자동향조사' 결과에 따르면, 6개월 후 <b>금리</b> 전망인 <b>금리</b>수준전망지수는 6p 내린 98을 기록했고 주택가격전망지수는 전월 대비 7p 오른 108로 나타나 1년 후 집값 하락보다 상승을... ","Tue, 23 Jul 2024 08:40:00 +0900"
2,[Who Is ?] 나혁휘 아이티엠반도체 대표이사 사장,https://www.businesspost.co.kr/BP?command=article_view&num=359767,https://www.businesspost.co.kr/BP?command=article_view&num=359767,"전방산업인 스마트폰 시장 경기가 나빠져 매출이 줄었고, <b>금리</b> 상승에 따른 이자비용 증가, 환율 변동에 따른 외환차익 감소 등 영업외비용의 증가로 순손실은 커졌다. 다만 전자담배 사업의 성장이 영업손실... ","Tue, 23 Jul 2024 08:40:00 +0900"
3,[Who Is ?] 김도언 뉴트리 대표이사,https://www.businesspost.co.kr/BP?command=article_view&num=359765,https://www.businesspost.co.kr/BP?command=article_view&num=359765,뉴트리 쪽은 2023년 실적 부진을 놓고 &quot;<b>금리</b>인상 및 경기침체에 따른 가계의 가처분소득 감소로... 뉴트리 쪽은 실적 악화 배경으로 △이너뷰티 부문 경쟁 심화 △<b>금리</b>인상 등으로 실질구매력 하락 △엔데믹으로... ,"Tue, 23 Jul 2024 08:40:00 +0900"
4,상반기 회사채 발행 역대급···대부분 차환 목적,http://www.hansbiz.co.kr/news/articleView.html?idxno=704212,http://www.hansbiz.co.kr/news/articleView.html?idxno=704212,"참고로 2022년 <b>금리</b> 상승으로 급격히 위축됐던 석유·화학 및 건설업종 발행은 지난해 상반기에 비해 50억원 늘었는데, 2023년 이후 점차 회복되는 모습이다. 금융채 발행은 1332건, 92조 4912억원으로 지난해... ","Tue, 23 Jul 2024 08:40:00 +0900"
5,[Who Is ?] 최상목 경제부총리 겸 기획재정부 장관,https://www.businesspost.co.kr/BP?command=article_view&num=359764,https://www.businesspost.co.kr/BP?command=article_view&num=359764,당장 경기 둔화 및 고<b>금리</b> 기조로 인한 부동산 프로파이낸싱(PF) 부실 문제를 잘 풀어내 건설사 및 금융사... 고물가·고<b>금리</b>·고환율 등 이른바 '3고'로 경제가 어려운 상황에서 관계기관회의를 열어 경제 현안을... ,"Tue, 23 Jul 2024 08:40:00 +0900"
6,"동반위, 전력거래소·농어촌공사와 협력사 ESG 환경조성 지원",https://view.asiae.co.kr/article/2024072308391854881,https://n.news.naver.com/mnews/article/277/0005449263?sid=101,"특히, ESG 지표 준수율이 우수한 협력사에게는 'ESG 우수 중소기업 확인서'를 발급, <b>금리</b>우대(신한·기업·경남·국민은행), 해외진출 지원사업 우대(KOTRA, KOICA), 환경·에너지 기술지원(한국에너지기술연구원) 등의... ","Tue, 23 Jul 2024 08:39:00 +0900"
7,"[해외시황] 뉴욕증시, 기술주 강세 속 상승…나스닥 1.58%↑",http://www.newsprime.co.kr/news/article.html?no=647481,http://www.newsprime.co.kr/news/article.html?no=647481,국채 <b>금리</b>는 장기물을 중심으로 소폭 올랐다. 벤치마크 <b>금리</b>인 미국 국채 10년물은 전일비 1.4bp 상승한 4.25%를 기록했다. 정책<b>금리</b> 전망에 민감한 2년물은 0.6bp 오른 4.52%에서 거래됐다. 주요 6개 통화 대비 달러... ,"Tue, 23 Jul 2024 08:38:00 +0900"
8,"카카오뱅크, '저금통with메가박스' 출시",https://www.cstimes.com/news/articleView.html?idxno=602837,https://www.cstimes.com/news/articleView.html?idxno=602837,이번 상품은 제휴를 통해 <b>금리</b> 외에 추가 혜택을 담아 선보이는 5번째 '브랜드저금통'으로 '저금통with메가박스'에 가입한 고객은 연 8%의 <b>금리</b>와 함께 메가박스의 다양한 혜택을 함께 즐길 수 있다.... ,"Tue, 23 Jul 2024 08:38:00 +0900"
9,"한국수력원자력, 5억달러 글로벌본드 발행 성공",https://news.einfomax.co.kr/news/articleView.html?idxno=4318126,https://news.einfomax.co.kr/news/articleView.html?idxno=4318126,"트랜치(tranche)는 5년물 고정<b>금리</b>부채권(FXD)이다. 이번 채권은 글로벌본드 형태로 아시아와 유럽, 미국 등에서 투자자 모집을 진행했다. 가산<b>금리</b>(스프레드)는 동일 만기 미국 국채<b>금리</b>에 70bp를 더한 수준이다. 이에... ","Tue, 23 Jul 2024 08:36:00 +0900"
0,"한국수력원자력, 5억달러 글로벌본드 발행 성공",https://news.einfomax.co.kr/news/articleView.html?idxno=4318126,https://news.einfomax.co.kr/news/articleView.html?idxno=4318126,"트랜치(tranche)는 5년물 고정<b>금리</b>부채권(FXD)이다. 이번 채권은 글로벌본드 형태로 아시아와 유럽, 미국 등에서 투자자 모집을 진행했다. 가산<b>금리</b>(스프레드)는 동일 만기 미국 국채<b>금리</b>에 70bp를 더한 수준이다. 이에... ","Tue, 23 Jul 2024 08:36:00 +0900"
1,"[굿모닝 마켓] 트럼프 트레이드 완화되나?…뉴욕증시, 랠리 재가동",https://biz.sbs.co.kr/article_hub/20000183111?division=NAVER,https://n.news.naver.com/mnews/article/374/0000394056?sid=104,"지난주에는 <b>금리</b> 인하 가능성이 커지면서 투자자들이 중소형주를 선택했고, 반면 기술주는 하락 압력을... 국채 <b>금리</b>는 3일째 오르고 있습니다. 10년물 국채<b>금리</b>는 4.257%를, 연준 정책에 민감하게 반응하는 2년물은 4.51... ","Tue, 23 Jul 2024 08:34:00 +0900"
2,"[글로벌마켓 모닝 브리핑] 뉴욕증시, 바이든 사퇴에도 기술주 랠리에 상승",https://www.etoday.co.kr/news/view/2382868,https://www.etoday.co.kr/news/view/2382868,로이터통신은 미국 연방준비제도(Fed·연준)의 기준<b>금리</b> 인하 가능성과 실적 호조 기대감에 기술주가... 중국은 이날 ‘사실상의 기준<b>금리</b>’인 대출우대<b>금리</b>(LPR)와 주요 단기 정책<b>금리</b>를 일제히 인하했다. <b>금리</b>... ,"Tue, 23 Jul 2024 08:34:00 +0900"
3,기술주 살린 엔비디아…랠리 운명 쥔 알파벳 실적 [글로벌마켓 A/S],http://www.wowtv.co.kr/NewsCenter/News/Read?articleId=A202407230281&t=NN,https://n.news.naver.com/mnews/article/215/0001172013?sid=101,"22% 내린 배럴당 79.95달러로 80달러선이 깨졌다. 중국이 <b>금리</b>인하고 경기 부양을 시도했지만 수요 회복에 제한적일 가능성에 무게가 실린다. 국제금값은 0.06% 오른 트로이온스당 2,400.5달러를 기록했다.","Tue, 23 Jul 2024 08:32:00 +0900"
4,‘트럼프 트레이드’ 잦아들까…환율 1380원 중반대 등락[외환브리핑],http://www.edaily.co.kr/news/newspath.asp?newsid=01459606638957472,https://n.news.naver.com/mnews/article/018/0005795393?sid=101,시카고상품거래소(CME) 페드워치툴에 따르면 9월 <b>금리</b> 인하 확률을 92.3%로 반영했다. 전 거래일보다 다소 후퇴한 수치다. 12월 말까지 기준<b>금리</b>가 25bp씩 3회 인하할 확률은 40% 중반까지 줄어들었다. 국채<b>금리</b>는 3일째... ,"Tue, 23 Jul 2024 08:32:00 +0900"
5,"하나證 &quot;HD현대인프라코어, 러-우 재건 기대감…매수 유지&quot;",https://www.newsis.com/view/NISX20240723_0002821375,https://n.news.naver.com/mnews/article/003/0012682128?sid=101,"하나증권은 23일 HD현대인프라코어에 대해 &quot;고<b>금리</b> 지속에 따른 수요 부진으로 2분기 실적이 전망치를 밑돌았다&quot;면서도 &quot;향후 시차를 두고 확인될 <b>금리</b>인하 효과, 미중 정책 드라이브 등 이벤트들을 지켜볼 필요가 있다&quot;고... ","Tue, 23 Jul 2024 08:31:00 +0900"
6,"HD현대인프라코어,올 2Q 매출·영업이익 모두 감소",https://www.electimes.com/news/articleView.html?idxno=340608,https://www.electimes.com/news/articleView.html?idxno=340608,"하반기부터는 북미를 비롯한 선진시장에서 <b>금리</b> 인하와 인프라 투자 확대, 리쇼어링 정책 등이 본격화되면 시장이 회복세를 보일 것으로 HD현대인프라는 전망했다. 신흥시장 또한 브라질과 인도네시아를 비롯한... ","Tue, 23 Jul 2024 08:30:00 +0900"
7,[증시 포인트] 반도체주 중심 반등 전망...中 경기부양 기대감도 긍정적,http://www.opinionnews.co.kr/news/articleView.html?idxno=102323,http://www.opinionnews.co.kr/news/articleView.html?idxno=102323,전일 중국 정부가 사실상의 기준<b>금리</b> 역할을 하는 대출우대<b>금리</b>(LPR)를 5개월만에 인하한 가운데 중국의 경기부양 기대감이 확대되는 것이 긍정적이라는 평가도 나왔다. 하이투자증권은 &quot;최근 상대적으로 중국에... ,"Tue, 23 Jul 2024 08:28:00 +0900"
8,추락하는 국고채 <b>금리</b>…8월 인하 기대 줄었는데 왜?,https://news.einfomax.co.kr/news/articleView.html?idxno=4318124,https://news.einfomax.co.kr/news/articleView.html?idxno=4318124,"(출연 : 손지현 연합인포맥스 기자, 진행 : 이민재) 지난주 국고채 <b>금리</b>가 급락해 부담스러운 레벨에 도달했습니다. 어느 수준까지 하락했는지 설명해주시죠. [손지현 기자] 네. 지난주 한 주간 국고채 <b>금리</b>는 대체로... ","Tue, 23 Jul 2024 08:28:00 +0900"
9,글로벌 <b>금리</b> 반영하며 보합…5000억원 규모 20년물 입찰[채권브리핑],http://www.edaily.co.kr/news/newspath.asp?newsid=01446486638957472,https://n.news.naver.com/mnews/article/018/0005795389?sid=101,23일 국내 국고채 시장은 간밤 미국채 <b>금리</b> 흐름을 반영하며 보합 출발할 것으로 예상된다. 채권 <b>금리</b>와 가격은 반대로 움직인다. 이날 개장 전 발표된 생산자물가지수는 전월 대비 0.1% 하락하며 7개월 만에... ,"Tue, 23 Jul 2024 08:28:00 +0900"
0,[뉴욕금값] 연준 인하 단서 대기 경계에…4거래일째 하락,https://www.etoday.co.kr/news/view/2382860,https://www.etoday.co.kr/news/view/2382860,이투데이=이진영 기자 | ‘바이든 사퇴’에 장 초반 상승 후 아래로 전환 7월 FOMC서 <b>금리</b> 하향 가능성도... 기준<b>금리</b> 인하 시점에 대한 추가적인 단서를 대기하며 금값은 약세로 마무리했다. CNBC에 따르면 투자자들은... ,"Tue, 23 Jul 2024 08:28:00 +0900"
1,"&quot;HD현대인프라코어, 기대 이하 실적 예상…목표가↓&quot;-교보",https://www.hankyung.com/article/2024072319396,https://n.news.naver.com/mnews/article/015/0005013049?sid=101,"안 연구원 “북미 지역의 경우 9월 <b>금리</b> 인하, 도널드 트럼프 전 대통령의 당선 기대감에 따른 전토 사업... 다만 유럽 지역에 대해서는 “경기에 대한 자신감이 낮아져 있는 상황”이라며 “<b>금리</b> 인하 효과가 나타날... ","Tue, 23 Jul 2024 08:28:00 +0900"
2,금융위원장 후보자도 “예금자보호 1억원 상향 동의”...23년 만에 한도 오르...,https://www.news2day.co.kr/article/20240722500242,https://www.news2day.co.kr/article/20240722500242,일각에선 예금자보호 한도를 1억원으로 똑같이 올리면 상대적으로 <b>금리</b>가 높은 저축은행 등에 대규모 자금이 이동하는 ‘머니 무브’가 일어날 가능성을 제기한다. 여신 관리와 심사 능력에 차이가 있는 가운데 대규모... ,"Tue, 23 Jul 2024 08:26:00 +0900"
3,[코스피·코스닥 22일 주요 공시] HD현대인프라코어 2분기 영업익 815억원…전...,http://www.betanews.net:8080/article/1471386.html,http://www.betanews.net:8080/article/1471386.html,"HD현대인프라코어는 하반기 북미 등 선진시장에서 <b>금리</b> 인하와 인프라 투자 확대, 리쇼어링 정책 등으로 건설장비 시장이 회복될 것으로 기대하고 있다. 회사는 연말 건설기계 수요 회복에 맞춰 신모델... ","Tue, 23 Jul 2024 08:26:00 +0900"
4,자회사 편입에 재무 부담 덜어낸 SK에코플랜트…조달 '청신호',https://news.einfomax.co.kr/news/articleView.html?idxno=4318123,https://news.einfomax.co.kr/news/articleView.html?idxno=4318123,"희망 <b>금리</b> 밴드는 마이너스(-)30bp에서 플러스(+)130bp를 제시할 예정이다. 이전에도 SK에코플랜트는 밴드 상단을 150bp까지 열어두곤 했는데, 이번 역시 폭넓게 수요를 확보하고자 밴드를 설정한 것으로 보인다.... ","Tue, 23 Jul 2024 08:26:00 +0900"
5,"HD현대인프라코어, 2분기 실적 부진…하반기 회복 기대 [교보증권]",https://www.ekn.kr/web/view.php?key=20240723020241164,https://www.ekn.kr/web/view.php?key=20240723020241164,"지역별 성과를 보면, 선진 시장에서는 유럽 경기 둔화와 북미 고<b>금리</b> 상황으로 인해 수요 부진이... 하반기 전망에 대해 안 연구원은 “북미 지역은 9월 <b>금리</b> 인하와 트럼프 당선 기대감으로 인해 전통 사업 투자 및... ","Tue, 23 Jul 2024 08:22:00 +0900"
6,"美 뉴욕증시, 바이든 사퇴에도 저가 매수로 반등…나스닥 1.58% 상승 마감",http://www.newsroad.co.kr/news/articleView.html?idxno=30182,http://www.newsroad.co.kr/news/articleView.html?idxno=30182,(Fed·연준)의 <b>금리</b>인하 기대감은 투자자들에게 다소 희망을 줬다&quot;고 말했다. 이날 주요 기술주 중에선... 시카고상품거래소(CME) 페드워치툴에 따르면 연방기금<b>금리</b> 선물시장은 이날 마감 무렵 9월 <b>금리</b> 인하 확률을... ,"Tue, 23 Jul 2024 08:22:00 +0900"
7,[김대호 박사의 오늘 기업·사람] 대한항공·보잉·GE·구글·MS·테슬라,https://biz.sbs.co.kr/article_hub/20000183092?division=NAVER,https://n.news.naver.com/mnews/article/374/0000394055?sid=101,- 美 빅테크 반등…구글 알파벳·테슬라 등 실적 주목 - 지난주 <b>금리</b>인하 전망 속 빅테크→중소형주 순환매 - 23일 알파벳·테슬라 실적 공개…MS·애플 등 대기 - 대만 TSMC 예상 웃돈 실적 발표에도 주가 지지부진... ,"Tue, 23 Jul 2024 08:21:00 +0900"
8,"[클릭 e종목]HD현대인프라코어, 2분기 실적 부진…목표가 1만1000원↓",https://view.asiae.co.kr/article/2024072308201347554,https://n.news.naver.com/mnews/article/277/0005449243?sid=101,"하반기엔 북미지역의 경우 9월 <b>금리</b> 인하, 트럼프 당선 효과 등이 자사에 긍정적으로 작용할 전망이다. 안 연구원은 &quot;하반기에는 북미지역의 경우 9월 <b>금리</b> 인하, 트럼프 당선 기대감에 따라 전통 사업 투자 및 제조업... ","Tue, 23 Jul 2024 08:20:00 +0900"
9,"뉴욕증시, 바이든 사퇴에도 저가 매수로 반등…나스닥 1.58%↑ 마감",https://news.einfomax.co.kr/news/articleView.html?idxno=4318121,https://news.einfomax.co.kr/news/articleView.html?idxno=4318121,(Fed·연준)의 <b>금리</b>인하 기대감은 투자자들에게 다소 희망을 줬다&quot;고 말했다. 이날 주요 기술주 중에선... 시카고상품거래소(CME) 페드워치툴에 따르면 연방기금<b>금리</b> 선물시장은 이날 마감 무렵 9월 <b>금리</b> 인하 확률을 94.... ,"Tue, 23 Jul 2024 08:18:00 +0900"
