,title,originallink,link,description,pubDate
8,美 바이든 사퇴하자… 亞증시 일제히 약세,https://www.donga.com/news/Economy/article/all/20240722/126059475/2,https://n.news.naver.com/mnews/article/020/0003577851?sid=101,중국 인민은행이 이날 시장 예상을 깨고 5개월 만에 사실상 기준<b>금리</b>인 대출우대<b>금리</b>(LPR)를 인하하며 유동성 공급에 나섰지만 증시는 오히려 하락했다. 바이든 대통령 사퇴로 트럼프 후보 당선 가능성이 높아진 게... ,"Tue, 23 Jul 2024 03:04:00 +0900"
9,"시진핑 “경제 ‘회색코뿔소’ 위험대비”… 中, 5개월만에 <b>금리</b> 인하로 돈 풀...",https://www.donga.com/news/Inter/article/all/20240723/126061578/2,https://n.news.naver.com/mnews/article/020/0003577841?sid=104,"이를 위해 중국은 제20기 중앙위원회 제3차 전체회의(20기 3중전회)가 끝나자마자 기준<b>금리</b>를 낮추며 유동성... 한편 런민(人民)은행은 5년 만기 대출우대<b>금리</b>(LPR)를 연 3.85%로, 1년 만기 LPR를 3.35%로 각각 0.1%포인트씩... ","Tue, 23 Jul 2024 03:03:00 +0900"
0,"유럽증시, 바이든 사퇴 긍정 평가하며 일제히 상승…기술·명품 섹터↑",https://www.newspim.com/news/view/20240723000010,https://www.newspim.com/news/view/20240723000010,"장·단기 <b>금리</b>를 인하해 시장을 놀라게 한 후 루이비통모에헤네시(LVMH)와 케링, 휴고보스 등 명품 업체들 주가가 1.2~4.3% 올랐다&quot;고 말했다. 중국인민은행은 이날 '동결' 예상을 깨고 5년물 대출우대<b>금리</b>(LPR)를 3.85%로... ","Tue, 23 Jul 2024 02:36:00 +0900"
1,"모건스탠리 &quot;美 중소형주, 대형주 계속 앞지르긴 어려울 것&quot;",https://news.einfomax.co.kr/news/articleView.html?idxno=4318103,https://news.einfomax.co.kr/news/articleView.html?idxno=4318103,윌슨은 &quot;연방준비제도(Fed·연준)가 기준<b>금리</b> 인하를 시작하면 중소기업이 혜택을 볼 것이라는 관측 또한 있지만 실제로는 <b>금리</b>인하가 시작되면 거대 성장기업이 가장 높은 수익률을 기록했다&quot;며 &quot;<b>금리</b>인하 시기엔 통상... ,"Tue, 23 Jul 2024 02:30:00 +0900"
2,"경남신보, 역대 최대 출연금 320억원 확보",http://www.gnnews.co.kr/news/articleView.html?idxno=558299,http://www.gnnews.co.kr/news/articleView.html?idxno=558299,경남신보는 출연금 확보 외에도 소상공인의 <b>금리</b>부담 완화를 위해서도 지속 노력하고 있다. 하반기 시·군 소상공인 정책자금을 1051억원으로 기존 계획보다 355억원 확대해 실시할 예정이다. 이효근 이사장은 &quot;출연금... ,"Tue, 23 Jul 2024 02:22:00 +0900"
3,"MG새마을금고, 집중호우 피해복구 금융지원 나서",https://www.nbntv.co.kr/news/articleView.html?idxno=3021632,https://www.nbntv.co.kr/news/articleView.html?idxno=3021632,"긴급자금 대출 시 최고 2%의 범위 내에서 금고별 상황에 따라 우대<b>금리</b> 적용이 가능하며, 수해 피해 고객에게 피해복구를 위한 실질적인 도움이 될 것으로 기대된다. 또한 기존 대출고객에 대한 금융지원으로는 대출... ","Tue, 23 Jul 2024 02:04:00 +0900"
4,美 달러화 혼조…바이든 사퇴 여파 '가늠 어려워',https://news.einfomax.co.kr/news/articleView.html?idxno=4318102,https://news.einfomax.co.kr/news/articleView.html?idxno=4318102,현재 달러화 가치에 밀접하게 연동된 것은 미국 기준<b>금리</b>인데 바이든 사퇴로 <b>금리</b>인하 속도가 불투명해졌다. 9월 기준<b>금리</b> 인하는 여전히 시장에서 기정사실로 받아들이고 있다. 다만 누가 민주당 대선후보가 될지... ,"Tue, 23 Jul 2024 01:50:00 +0900"
5,"삼성운용, 'KODEX 타겟프리미엄 ETF' 3종 순자산 5000억 돌파",https://www.apnews.kr/news/articleView.html?idxno=3022283,https://www.apnews.kr/news/articleView.html?idxno=3022283,"또 AI산업 성장에 따른 수혜가 기대되는 미국AI테크주, 미국<b>금리</b>인하 시 자본차익이 기대되는 미국30년국채, SCHD ETF로 잘 알려진 미국배당성장주 등 다양한 자산군으로 설계됐다. 각자의 선호와 시장전망에... ","Tue, 23 Jul 2024 01:00:00 +0900"
6,"미국 뉴욕증시, 바이든 재선 포기에도 나스닥-반도체-S&amp;P 상승 전환 다우는 하...",https://www.socialvalue.kr/news/view/1065541253852094,https://www.socialvalue.kr/news/view/1065541253852094,미국 국채<b>금리</b>는 이날 소폭 상승하고 있다. 현지시간 오전 11시 39분 현재 10년물이 전날보다 0.017%포인트... 시장은 연준이 오는 9월 공개시장위원회(FOMC)에서 기준<b>금리</b>를 인하할 것을 기정사실로 받아들이고 있다.... ,"Tue, 23 Jul 2024 00:58:00 +0900"
7,집값 상승에 주택 ‘초단타 매도’ 5년來 최저,https://www.chosun.com/economy/real_estate/2024/07/23/2QUDG4ZR5VFJLN3AHESEYVC6EE/?utm_source=naver&utm_medium=referral&utm_campaign=naver-news,https://n.news.naver.com/mnews/article/023/0003847833?sid=101,2022년 하반기부터 <b>금리</b>가 오르고 부동산 경기 침체가 본격화하자 단기 매도가 크게 늘었다. 문재인 정부 집값 급등기 때 집을 산 ‘영끌족’이 급격한 <b>금리</b> 인상에 따른 이자 부담을 견디지 못하고 ‘손절매’에... ,"Tue, 23 Jul 2024 00:46:00 +0900"
8,"美 국채가, 바이든 사퇴 후 혼조…불확실성 커져",https://news.einfomax.co.kr/news/articleView.html?idxno=4318100,https://news.einfomax.co.kr/news/articleView.html?idxno=4318100,미국 10년물 국채<b>금리</b> 일별 추이[출처 : 연합인포맥스] 연합인포맥스의 해외<b>금리</b> 일중 화면(화면번호 6532)에 따르면 22일(미국 동부시간) 오전 9시 현재 뉴욕 채권시장에서 10년물 국채<b>금리</b>는 전 거래일 오후 3시... ,"Tue, 23 Jul 2024 00:42:00 +0900"
9,[경제시평] 불확실성 상황에서 통화정책은,https://www.kmib.co.kr/article/view.asp?arcid=1721612214&code=11171313&cp=nv,https://n.news.naver.com/mnews/article/005/0001712665?sid=110,"<b>금리</b> 인하에 대한 기대가 커지고 있다. 캐나다, 스위스, 유로존 등 선진국뿐 아니라 브라질, 멕시코, 체코, 헝가리 등 신흥국에서도 기준<b>금리</b>를 내렸다. 인플레이션이 높은 미국은 고<b>금리</b>를 유지하고 있지만 올 하반기에는... ","Tue, 23 Jul 2024 00:33:00 +0900"
0,오늘의 금값시세(7월 23일자) &quot;2024년 독일 금값 전망&quot;,https://www.gukjenews.com/news/articleView.html?idxno=3049814,https://www.gukjenews.com/news/articleView.html?idxno=3049814,"미 연방준비제도이사회(FRB)가 <b>금리</b>를 인상하면 금값 하락, 세계 경제 침체 우려가 커지면 투자자들이 위험 자산을 매도하고 안전 자산으로 투자하기 때문에 금값 하락 가능성도 있다. 독일 국채 <b>금리</b> 변동은... ","Tue, 23 Jul 2024 00:16:00 +0900"
1,울산서도 LH택지 계약해지 속출,https://www.ksilbo.co.kr/news/articleView.html?idxno=1004690,https://www.ksilbo.co.kr/news/articleView.html?idxno=1004690,침체와 <b>금리</b> 인상 등에 사업이 발목 잡히면서 사전청약은커녕 본청약 등 사업을 추진하지 못한 것으로... LH는 프로젝트파이낸싱(PF) 대출 중단과 고<b>금리</b> 등 시장 상황을 고려해 이들 부지에 대해 계약금 10%를 제외한... ,"Tue, 23 Jul 2024 00:12:00 +0900"
2,[데일리 Talk] 넥슨은 유저와 소상공인 안 보이나,https://www.skyedaily.com/news/news_view.html?ID=240318,https://www.skyedaily.com/news/news_view.html?ID=240318,그러잖아도 높은 <b>금리</b>와 최저 시급에 허덕이고 있고 이를 버티지 못해 폐업하는 경우도 증가하고 있는데 수익만 밝히는 넥슨의 눈엔 이런 게 보이지 않는 것일까. 그렇다고 유저들의 목소리를 듣는 것도 아니다.... ,"Tue, 23 Jul 2024 00:06:00 +0900"
3,HD현대인프라코어 주가 '훌쩍'…하반기 <b>금리</b>인하후 인프라 투자 확대 기대,https://cwn.kr/article/1065599311186614,https://cwn.kr/article/1065599311186614,"또한 하반기부터는 북미를 비롯한 선진시장에서 <b>금리</b> 인하와 인프라 투자 확대, 리쇼어링 정책 등이 본격화되면 시장이 회복세를 보일 것으로 전망했다. 신흥시장도 브라질과 인도네시아를 비롯한 국가들에서... ","Tue, 23 Jul 2024 00:06:00 +0900"
4,"[증권소식] 금감원 &quot;국내 회계법인, 해외보다 통합관리체계 미흡&quot;/올 상반기 ...",https://www.asiatime.co.kr/article/20240723500002,https://www.asiatime.co.kr/article/20240723500002,"AI산업 성장에 따른 수혜가 기대되는 미국AI테크주, 미국<b>금리</b>인하 시 자본차익이 기대되는 미국30년국채, SCHD ETF로 잘 알려진 미국배당성장주 등 다양한 자산군으로 설계됐다. 각자의 선호와 시장전망에 맞춰... ","Tue, 23 Jul 2024 00:06:00 +0900"
5,[Editor’s Note] ‘숨겨진 빚’ 1경원 이상? <b>금리</b> 내린 중국 속사정,https://www.joongang.co.kr/article/25265313,https://n.news.naver.com/mnews/article/025/0003374969?sid=101,중국이 시장 예상과는 달리 ‘사실상의 기준<b>금리</b>’인 대출우대<b>금리</b>(LPR)를 5개월 만에 내렸습니다. 앞서 로이터통신은 시장 전문가 36명을 조사해 보니 64%가 동결을 예상했다고 전했습니다. 중국이 <b>금리</b>를 내리며 경기... ,"Tue, 23 Jul 2024 00:03:00 +0900"
6,"동성로, 대구 첫 관광특구 지정…서울 홍대거리처럼 만든다",https://www.joongang.co.kr/article/25265289,https://n.news.naver.com/mnews/article/025/0003374944?sid=102,"관광진흥개발기금 우대<b>금리</b> 융자지원, 관광특구 활성화 국비 지원사업 추진, 옥외광고물 허가기준 완화 등이 있으며 공개공지에서의 공연도 가능해진다. 또 최상급 호텔에 외국인 전용 카지노 조성도 할 수 있다. 이런... ","Tue, 23 Jul 2024 00:02:00 +0900"
7,"비트코인 시세, 바이든 재선 불출마",https://www.bntnews.co.kr/article/view/bnt202407220140,https://www.bntnews.co.kr/article/view/bnt202407220140,"인플레이션 완화와 <b>금리</b> 인하 기대감이 커지고 있으며, 스테이블코인 공급이 늘어나고 이더리움(ETH) 현물... 도널드 트럼프 전 대통령의 재선 가능성, 마운트곡스의 비트코인 배분, 연방준비제도의 <b>금리</b> 인하 기대감 등... ","Tue, 23 Jul 2024 00:02:00 +0900"
8,"뉴욕증시, 바이든 재선 포기 후 첫 거래일 기술주↑…상승 출발",https://www.yna.co.kr/view/AKR20240723000200009?input=1195m,https://n.news.naver.com/mnews/article/001/0014822231?sid=101,"시장은 연준이 오는 9월 공개시장위원회(FOMC)에서 기준<b>금리</b>를 인하할 것을 기정사실로 받아들이고 있다. 이같은 분위기 속에 투자자들은 최근 한동안, 지난 상반기 랠리를 주도한 대형 기술주들을 팔아치우고 <b>금리</b>... ","Tue, 23 Jul 2024 00:01:00 +0900"
9,4대 금융지주 2분기 성적표 나온다...어디가 잘했나 주목,http://news.tf.co.kr/read/economy/2117917.htm,https://n.news.naver.com/mnews/article/629/0000306675?sid=101,또한 대출<b>금리</b>가 오르며 은행의 이익 증가로 금융지주들의 실적 개선에 영향을 미칠 것으로 예상된다. 박혜진 대신증권 연구원은 &quot;은행 5사 2분기 순이익은 컨센서스 4.6조원을 소폭(3.7%) 상회할 것&quot;이라며... ,"Tue, 23 Jul 2024 00:01:00 +0900"
0,"경기 부진에 급해진 중국, 5개월 만에 기준<b>금리</b> 또 내렸다",https://www.joongang.co.kr/article/25265275,https://n.news.naver.com/mnews/article/025/0003374930?sid=101,기준<b>금리</b> 인하를 단행했다. 다만 부동산 산업 침체와 커지는 미·중 갈등으로 경제 활로 찾기는 여전히 쉽지 않다는 지적이 나온다. 22일 중국의 중앙은행인 중국인민은행은 5년 만기 대출우대<b>금리</b>(LPR)를 3.95→3.85%로... ,"Tue, 23 Jul 2024 00:01:00 +0900"
1,[사설] 대도시 지역상품권 인근 지역 매출 감소…포퓰리즘 입법 멈추라,https://www.sedaily.com/NewsView/2DBUMQAX7T,https://n.news.naver.com/mnews/article/011/0004370153?sid=110,또 큰돈을 한꺼번에 풀게 되면 물가 상승을 부추겨 <b>금리</b> 인하 시점이 늦춰질 수도 있다. 한국은행의 2020년 분석에 따르면 정부 이전지출이 1원 늘어난 뒤 3년 동안 국내총생산(GDP) 증가는 연평균 0.33원에 그쳤다. 상품권... ,"Tue, 23 Jul 2024 00:01:00 +0900"
2,뉴욕증시 비트코인 &quot;대폭락 조짐&quot; 헤지펀드,http://www.g-enews.com/ko-kr/news/article/news_all/2024072119535825254a01bf698f_1/article.html,http://www.g-enews.com/ko-kr/news/article/news_all/2024072119535825254a01bf698f_1/article.html,이같은 폭락 경구에 뉴욕증시는 물론 비트코인이더리움 리플등 가상 암호화폐와 달러환율 국채<b>금리</b>... 그는 그러나 기준<b>금리</b> 인하가 전체적인 시장 방향의 전환을 알리는 '시작 총소리'가 된 경우가 자주 있다고... ,"Tue, 23 Jul 2024 00:00:00 +0900"
3,"새마을금고, 폭우 피해지역 금융지원…김인 &quot;실질적 혜택 집중&quot;",https://www.apnews.kr/news/articleView.html?idxno=3022279,https://www.apnews.kr/news/articleView.html?idxno=3022279,"긴급자금 대출 시 최고 2%의 범위 내에서 금고별 상황에 따라 우대<b>금리</b> 적용이 가능하고, 수해 피해 고객에게 피해복구를 위한 실질적인 도움이 될 것으로 기대된다. 또 기존 대출고객에 대한 금융지원으로는 대출... ","Tue, 23 Jul 2024 00:00:00 +0900"
4,"경기도, 수해 등 재해피해기업 지원 특별경영자금 200억원 확대",http://www.seoulfn.com/news/articleView.html?idxno=526912,http://www.seoulfn.com/news/articleView.html?idxno=526912,"융자 한도는 피해 금액 범위 내 기업 1곳당 최대 5억원(소상공인 5000만원) 이내, 1년 거치 3년 균등분할 상환 조건이며 융자 <b>금리</b>는 은행 대출<b>금리</b>에서 중소기업은 1.5%, 소상공인은 2% 이자를 고정 지원한다. 이 밖에도... ","Mon, 22 Jul 2024 23:37:00 +0900"
5,"대우건설, 1972억 '마포 성산 모아타운' 1구역 시공사 선정",https://www.apnews.kr/news/articleView.html?idxno=3022259,https://www.apnews.kr/news/articleView.html?idxno=3022259,"또 사업 조건으로는 주택도시보증공사(HUG) 최고 신용등급 AAA를 통한 필요 사업비 최저 <b>금리</b> 조달, 조합 필요 사업비 직접 대여, 조합원 분담금 입주시 100% 납부, 추가 이주비 조달 등의 조건을 제시해 조합원 자금... ","Mon, 22 Jul 2024 23:32:00 +0900"
6,"경주시, 한수원과 함께 중소기업 대출이자 4% 지원",https://www.pointe.co.kr/news/articleView.html?idxno=27038,https://www.pointe.co.kr/news/articleView.html?idxno=27038,"이 사업은 한수원이 경주 상생 협력 기금을 NH농협은행에 1000억 원을 예탁해 지역 중소기업에 대출 <b>금리</b>를 지원하는 시스템으로 2021년 7월 경주시와 한수원, NH농협은행이 상호 협약으로 추진됐다. 대출한도는 기업당... ","Mon, 22 Jul 2024 23:26:00 +0900"
7,중국 기준<b>금리</b> 0.1%P 인하,https://www.voakorea.com/a/7707986.html,https://www.voakorea.com/a/7707986.html,"중국이 사실상의 기준<b>금리</b>인 대출우대<b>금리</b>(LPR)를 5개월 만에 내렸습니다.중국 중앙은행인 인민은행은 22일 5년 만기 LPR을 연 3.85%로, 1년 만기 LPR을 연 3.35%로 각각 0.1%P 낮춘다고 발표했습니다.이번 조치는 5개월 만에... ","Mon, 22 Jul 2024 23:22:00 +0900"
8,"뉴욕증시, 바이든 사퇴 발표에 강세 출발… 나스닥 1%대↑",https://biz.chosun.com/international/international_economy/2024/07/22/YVP573OFABF6FII37XZKZVYXR4/?utm_source=naver&utm_medium=original&utm_campaign=biz,https://n.news.naver.com/mnews/article/366/0001006603?sid=104,"81에 각각 거래됐다. 채권<b>금리</b>는 소폭 하락했다. 전자거래 플랫폼 트레이드웹에 따르면 이날 10년 만기 미 국채 수익률은 같은 시간 4.22%로, 지난 19일 뉴욕증시 마감 무렵 대비 2bp(1bp=0.01%포인트) 하락했다.","Mon, 22 Jul 2024 23:13:00 +0900"
9,미 대선 지각변동에 금융시장도 출렁…한은 안전자산 보유 문제 없나?,https://news.kbs.co.kr/news/pc/view/view.do?ncd=8018223&ref=A,https://n.news.naver.com/mnews/article/056/0011767050?sid=101,"[박상현/하이투자증권 연구위원 : &quot;트럼프 (당선에 따른) 불확실성도 있고, 미 연준 <b>금리</b> 인하 기대감도... 미국이 9월 기준<b>금리</b>를 내릴 확률이 커진 데다, 트럼프 대통령 당선 가능성까지 높아졌기 때문입니다. 미국... ","Mon, 22 Jul 2024 23:04:00 +0900"
0,"뉴욕증시, 바이든 사퇴 발표후 첫날 강세 출발…나스닥 1%대↑",https://www.yna.co.kr/view/AKR20240722164200072?input=1195m,https://n.news.naver.com/mnews/article/001/0014822196?sid=101,"채권<b>금리</b>는 소폭 하락했다. 전자거래 플랫폼 트레이드웹에 따르면 이날 10년 만기 미 국채 수익률은 같은 시간 4.22%로, 지난 19일 뉴욕증시 마감 무렵 대비 2bp(1bp=0.01%포인트) 하락했다. 시장 참가자들은 바이든... ","Mon, 22 Jul 2024 23:00:00 +0900"
1,올해 도내 축산농가 사료구매 자금 487억원 지원,http://www.jeonmin.co.kr/news/articleView.html?idxno=401785,http://www.jeonmin.co.kr/news/articleView.html?idxno=401785,"지원조건은 융자 100%, <b>금리</b> 1.8%, 2년 거치 일시상환이며, 신규 사료구매 대금과 기존 외상금액의 상환 용도로 사용할 수 있다. 특히, 사료비 상승과 수급 불균형으로 어려움을 겪고 있는 한우농가에는 332억원(68%)이 우선... ","Mon, 22 Jul 2024 23:00:00 +0900"
2,유력 애널리스트의 '이유 있는' 비트코인 강세 전망,http://coinreaders.com/118169,http://coinreaders.com/118169,"크루거는 9월 미국 연방준비제도(Fed, 연준)의 <b>금리</b> 인하를 확신하기도 했다. 보통 <b>금리</b> 인하는 비트코인처럼 변동성이 큰 가상자산 투자자가 투자 수익을 위해 활용하는 기회이다. 이어서 비트코인 현물 상장지수펀드... ","Mon, 22 Jul 2024 23:00:00 +0900"
3,"바이든 사퇴에 불확실성↓ 뉴욕증시, 상승 출발…엔비디아 4%↑",http://www.edaily.co.kr/news/newspath.asp?newsid=03604726638957144,https://n.news.naver.com/mnews/article/018/0005795295?sid=101,"지난주에는 <b>금리</b>인하 가능성이 커지면서 투자자들이 중소형주를 선호하면서 기술주가 하락 압력을... 국채<b>금리</b>는 혼조세를 보이고 있다. 10년물 국채<b>금리</b>는 전 거래일 대비 1.8bp(1bp=0.01%포인트) 내린 4.22%를, 연준... ","Mon, 22 Jul 2024 22:59:00 +0900"
4,"뉴욕증시, 기술주 실적 기대 분위기 속 상승 출발",https://www.hankyung.com/article/202407221513i,https://n.news.naver.com/mnews/article/015/0005012999?sid=101,트레이더들은 미연방준비제도이사회가 9월 회의에서 <b>금리</b>를 인하할 가능성을 거의 93%로 예상하고 있다. 이를 염두에 두고 투자자들은 올해 주가가 크게 올랐던 대형 기술주를 매도하고 저<b>금리</b>로 혜택을 볼 수... ,"Mon, 22 Jul 2024 22:58:00 +0900"
5,기술주 발작 끝?...테슬라·엔비디아 동반 반등,https://www.dt.co.kr/contents.html?article_no=2024072202109963060010&ref=naver,https://n.news.naver.com/mnews/article/029/0002889592?sid=101,이에 따라 당분간 기업들의 2분기 실적과 연준의 <b>금리</b>인하로 다시 시선이 쏠릴 전망이다. 이번 주에는... 이날 개장 시점 시카고상품거래소(CME) 페드워치툴은 연준이 9월 <b>금리</b>를 25bp(1bp=0.01%포인트) 인하할 가능성을... ,"Mon, 22 Jul 2024 22:58:00 +0900"
6,"뉴욕증시, 기술주 랠리에 상승…6월 PCE·2분기 성장률 주목",https://view.asiae.co.kr/article/2024072222502693340,https://n.news.naver.com/mnews/article/277/0005449146?sid=101,"인플레이션 하락세가 지속될 경우 9월 기준<b>금리</b> 인하를 위한 토대 역시 더욱 탄탄해질 것으로 보인다. 6월... 시장은 인플레이션 하락과 고용시장 냉각, 성장률 둔화 조짐에 9월 <b>금리</b> 인하를 기정사실화 하고 있다.... ","Mon, 22 Jul 2024 22:50:00 +0900"
7,"메리츠證, 장원재∙김종민 투톱 체제로…&quot;제2의 도약 가속&quot;",https://www.apnews.kr/news/articleView.html?idxno=3022275,https://www.apnews.kr/news/articleView.html?idxno=3022275,지속되는 <b>금리</b> 상승기에도 선제적 유동성 확보와 리스크 관리로 안정적 실적을 내며 메리츠증권의 트레이딩 부문을 한 단계 끌어올렸다는 평가를 받고 있다. 메리츠증권관계자는 &quot;2명의 각자 대표는 금융투자업계... ,"Mon, 22 Jul 2024 22:44:00 +0900"
8,"이스라엘, 예멘 후틴 반군 미사일 요격... 중, 기준<b>금리</b> 0.1%p 인하",https://www.voakorea.com/a/7707932.html,https://www.voakorea.com/a/7707932.html,중국이 몇몇 주요 장단기 <b>금리</b>를 내렸습니다.베트남이 지난주 타계한 응우옌 푸 쫑 공산당 서기장의 국장을... 중국이 몇몇 중요한 <b>금리</b>를 내렸군요? 기자) 그렇습니다. 중국 인민은행이 중요한 몇몇 장단기 <b>금리</b>를... ,"Mon, 22 Jul 2024 22:42:00 +0900"
9,"한국은행 경남본부, 경남지역 미분양주택 리스크 점검",https://www.newsis.com/view/NISX20240722_0002821218,https://n.news.naver.com/mnews/article/003/0012681833?sid=102,"주택 건설 착공에 들어간 사업장 대부분이 시공 능력 평가 30위 이내 대형 건설사가 시공하고, 관련 사업도 순조롭게 진행되는 것으로 파악될 뿐 최근 시장 <b>금리</b>가 하락세여서 사업 부담 완화에 도움이 될 것으로 보기... ","Mon, 22 Jul 2024 22:31:00 +0900"
0,전북은행 '수해 피해 긴급 자금' 지원…1000억원 규모,https://view.asiae.co.kr/article/2024072222265285607,https://n.news.naver.com/mnews/article/277/0005449144?sid=102,"최고 1.0%P까지 <b>금리</b> 감면 혜택도 지원한다. 기존 대출 건은 최대 1년간 만기 연장과 상환유예가 가능하다. 카드 결제 최대 6개월 청구유예, 연체 채무 특별 채무조정 등을 지원할 계획이다. 전주, 완주, 익산, 군산을 비롯한... ","Mon, 22 Jul 2024 22:26:00 +0900"
1,"대우건설, 마포 성산 모아타운 1구역 시공사 선정",http://www.paxetv.com/news/articleView.html?idxno=208099,http://www.paxetv.com/news/articleView.html?idxno=208099,"사업 조건으로는 주택도시보증공사(HUG) 최고 신용등급 AAA를 통한 필요 사업비 최저 <b>금리</b> 조달, 조합 필요 사업비 직접 대여, 조합원 분담금 입주시 100% 납부, 추가 이주비 조달 등의 조건을 제시해 조합원 자금 부담을... ","Mon, 22 Jul 2024 22:23:00 +0900"
2,"울산, 올 상반기 경매 넘어간 부동산 '급증'",http://www.ujeil.com/news/articleView.html?idxno=351517,http://www.ujeil.com/news/articleView.html?idxno=351517,"고<b>금리</b> 장기화 및 경기침체, 전세 사기와 역전세 등의 여파로 올 상반기 울산에선 경매로 넘어가는... 특히 코로나19 확산으로 국내 기준<b>금리</b>가 0.5%까지 낮아진 저<b>금리</b> 시기 2022년 상반기(463건)와 비교하면 49.8%, 약 50... ","Mon, 22 Jul 2024 22:16:00 +0900"
3,"경기도, 재해피해기업 지원 특별경영자금 확대",https://www.thereport.co.kr/news/articleView.html?idxno=51713,https://www.thereport.co.kr/news/articleView.html?idxno=51713,"융자 한도는 피해 금액 범위 내 기업 1곳당 최대 5억 원(소상공인 5000만 원) 이내, 1년 거치 3년 균등분할 상환 조건이며 융자 <b>금리</b>는 은행 대출<b>금리</b>에서 중소기업은 1.5%, 소상공인은 2% 이자를 고정 지원한다. 이 밖에도... ","Mon, 22 Jul 2024 22:14:00 +0900"
4,[오늘의 금융가소식] 신한금융 外,http://www.betanews.net:8080/article/1471385.html,http://www.betanews.net:8080/article/1471385.html,"긴급자금 대출 시 최고 2%의 범위 내에서 금고별 상황에 따라 우대<b>금리</b> 적용이 가능하며, 수해 피해... 또한 서울보증보험의 보증보험을 통해 일반적인 ‘매출채권 팩토링’보다 낮은 <b>금리</b>가 적용되며 구매기업에 대한... ","Mon, 22 Jul 2024 22:06:00 +0900"
5,&quot;코로나 때보다 힘들다&quot; 개인회생 신청 급증,https://www.kwnews.co.kr/page/view/2024072214190080082,https://n.news.naver.com/mnews/article/087/0001057611?sid=101,A씨는 “고<b>금리</b>에 인건비 상승까지 겹쳐 빚이 눈덩이처럼 불어났다”며 “더 이상 버티지 못해 개인회생 절차를 밟고 있다”고 말했다. 고물가·고<b>금리</b>·고환율 등 3고(高) 경제위기로 올해 강원지역 상반기 개인회생... ,"Mon, 22 Jul 2024 22:03:00 +0900"
