,title,link,image,author,discount,publisher,pubdate,isbn,description
7,투자의 미래 (와튼 스쿨 제러미 시겔 교수의 시대를 초월하는 통찰),https://search.shopping.naver.com/book/catalog/32464654949,https://shopping-phinf.pstatic.net/main_3246465/32464654949.20230313185400.jpg,제러미 시겔,19800,이레미디어,20220120,9791191328448,"워런 버핏 강력 추천!
“제러미 시겔의 투자 원칙은 반드시 읽고 배워야 한다!” 
와튼 스쿨 제러미 시겔 교수의 시대를 초월하는 통찰
《투자의 미래》 완전개역판 출간!

주식투자 전략 분야에서 최고 권위자로 인정받고 있는 제러미 시겔의 저서를 새롭게 번역하고 다듬은 《투자의 미래》(원제: The Future for Investors) 완전개역판이 출간됐다. 워런 버핏이 “제러미 시겔의 투자 원칙은 반드시 읽고 배워야 한다!”고 강력 추천한 책이다.
“어떤 종목을 장기 보유해야 하는가?” “이미 가속화된 고령화 시대에서 어떻게 포트폴리오를 구성해야 하는가?”라는 투자자들의 숱한 질문에 대해 시겔 교수가 내놓은 대답은 초보 투자자와 전문 투자자, 그리고 청년과 장년, 노년의 구별을 무색하게 만든다. 그의 해답은 지식의 수준이나 세대에 상관없이 어느 누구에게나 적용할 수 있다.

“어떤 종목을 장기 보유해야 하는가?”를 고민할 때 대다수 투자자들은 기술 혁신을 주도하고 경제 성장을 이끄는 기업이 더 나은 수익을 준다고 믿는다. 그러나 시겔 교수는 보편적 믿음에 의문을 품었고 ‘S&P500 원조 기업’의 수익이 이후에 편입된 신규 기업의 수익을 앞지른다는 결론을 얻었다. 투자자들의 이런 잘못된 믿음, 즉 ‘성장 함정’의 실체를 파악하고 대응할 수 있는 전략을 제시하여 투자자와 투자 성공 사이를 가로막는 장벽을 부수고자 했다. 또 배당금의 중요성을 알아보고 투자자가 배당금을 효과적으로 활용할 수 있는 방안을 알려 준다.

시장의 극적인 변화와 기회를 적극적으로 활용할 수 있는 생생한 투자 전략을 통해 독자들은 시대를 초월하는 최고 권위자의 투자 철학을 들여다보는 것은 물론, 시장 평균을 웃도는 수익을 올려 재정적으로 풍요로운 미래를 맞는 데 도움이 되는 검증된 기업을 찾는 일 또한 수월하게 해낼 수 있을 것이다."
8,주식의 이해,https://search.shopping.naver.com/book/catalog/32445733741,https://shopping-phinf.pstatic.net/main_3244573/32445733741.20230131165239.jpg,이필상^안동현^손삼호^최영민,26100,홍문사,20220420,9788977707238,『주식의 이해』는 기본학습을 위한 길라잡이가 담긴 주식투자에 대해 다룬 도서이며 기초적이고 전반적인 내용을 확인할 수 있다.
9,허영만의 3천만원 1: 주식에 빠지다 (왕초보 허영만의 주식투자 도전기),https://search.shopping.naver.com/book/catalog/32453817705,https://shopping-phinf.pstatic.net/main_3245381/32453817705.20230926085006.jpg,허영만,12510,가디언,20180102,9788994909073,"실전 주식투자 만화 『허영만의 3천만원』 1권. 자신의 돈 3000만원을 직접 투자하며 그려낸 생생한 이야기가 담겨 있다. 과연 투자란 무엇인가. 식객, 타짜 등 명작을 완성시킨 저자 허영만은 '투자'의 세계를 직접 경험하기에 이른다. 주식투자 전문가들의 자문을 받아, 자신의 실제 돈을 직접 투자하여 현실성을 더했다. 전문가들의 조언은 여러 관점을 확인할 수 있었고, 그에 따라 시장의 흐름과 방향을 읽어내는 방법도 배울 수 있다. 다소 투자가 어렵게 느껴질 수 있는 초보자들도 쉽게 이해할 수 있도록 구성한 것이 특징이다. 실제로 주식투자에 뛰어든 작가가 주식시장의 현재 상황을 그때그때 전하며 자신의 투자 결과를 공개하는 참신한 시도를 보여준다. 투자 상황을 보기 쉽도록 각 장의 말미에 월별 누적 수익률 그래프와 각 자문단의 수익률을 실었다."
0,허영만의 6000만원 1: 박스권 하단에서 매수하라 (박스권 하단에서 매수하라),https://search.shopping.naver.com/book/catalog/32492243696,https://shopping-phinf.pstatic.net/main_3249224/32492243696.20230815080519.jpg,허영만,13050,가디언,20190819,9791189159405,"예측불가 주식 판에서 허영만은 살아남을 수 있을까?

2019년 4월 25일 카카오스탁, 지금의 ‘증권플러스 for Kakao’ 앱에서 연재를 시작한 허영만의 만화 『허영만의 6000만 원』 제1권 《박스권 하단에서 매수하라》. 실전 주식투자 만화로 인기를 끈 《허영만의 3천만원》의 후속작으로, 뒤늦게 주식에 뛰어든 허영만이 왕초보 꼬리표를 떼고 판돈을 두 배로 올려 6000만 원으로 다섯 명의 자문단과 함께 직접 주식을 매매하는 실제 상황을 그려냈다.

전작 《허영만의 3천만원》에서는 다섯 명의 자문단이 각 600만 원으로 주식투자를 시작했고 나중에 자문단 한 명을 대신해 허영만이 맛보기 느낌으로 투자를 이어갔다. 하지만 이번에는 허영만도 다섯 명의 자문단과 똑같이 1000만 원으로 주식을 시작했다. 내로라하는 이력을 가진 자문단들의 종목 선택과 그 이유, 각종 이슈들로 출렁대는 주식시장에 대처하는 자세 등 각양각색 투자 스타일을 들여다보고, 실제 상황에서 주식을 배워볼 수 있다.

또 이 책에서는 주식 고수들의 인터뷰를 만나볼 수 있다. 첫 번째 주인공은 ‘마하세븐’이라는 별칭으로 잘 알려진 한봉호를 인터뷰했다. 2019년 키움증권 실전투자대회 1억 리그에서 수익률 210%를 달성하며 1위를 차지한 한봉호는 주식을 시작한 이후 실전투자대회에서 총 18회 수상했다. 마라톤을 하듯 지치지 않고 꾸준히 공부하며 박스권 내에서 성장하는 주식을 찾아 안정적인 투자를 추구하는 한봉호는 꼭 지켜야 할 원칙과 주의해야 할 점들을 조언한다."
1,허영만의 6000만원 2: 저평가우량주를 알아보는 안목 (저평가 우량주를 알아보는 안목),https://search.shopping.naver.com/book/catalog/32492780724,https://shopping-phinf.pstatic.net/main_3249278/32492780724.20230815080546.jpg,허영만,13050,가디언,20191122,9791189159443,"예측불가 주식 판에서 허영만은 살아남을 수 있을까?

2019년 4월 25일 카카오스탁, 지금의 ‘증권플러스 for Kakao’ 앱에서 연재를 시작한 허영만의 만화 『허영만의 6000만 원』 제2권 《저평가우량주를 알아보는 안목》. 실전 주식투자 만화로 인기를 끈 《허영만의 3천만원》의 후속작으로, 뒤늦게 주식에 뛰어든 허영만이 왕초보 꼬리표를 떼고 판돈을 두 배로 올려 6000만 원으로 다섯 명의 자문단과 함께 직접 주식을 매매하는 실제 상황을 그려냈다. 

전작 《허영만의 3천만원》에서는 다섯 명의 자문단이 각 600만 원으로 주식투자를 시작했고 나중에 자문단 한 명을 대신해 허영만이 맛보기 느낌으로 투자를 이어갔다. 하지만 이번에는 허영만도 다섯 명의 자문단과 똑같이 1000만 원으로 주식을 시작했다. 내로라하는 이력을 가진 자문단들의 종목 선택과 그 이유, 각종 이슈들로 출렁대는 주식시장에 대처하는 자세 등 각양각색 투자 스타일을 들여다보고, 실제 상황에서 주식을 배워볼 수 있다. 

이 책에서는 1만 회원을 보유한 온라인 주식투자 교육 사이트 밸런스투자아카데미의 이정윤 대표와 현실 경제 경험이 풍부한 영남권 주식투자의 큰손 세광무역 손명완 대표의 인터뷰를 담았다. 자신만의 투자법을 정리해 책을 출간한 경험이 있는 이정윤은 저평가우량주를 가려내는 삼박자 투자법과 성공적인 투자 기법 등을 허영만에게 전수하고, 대구에서 직물 원사 사업을 하며 남다른 실물경제 감각을 지닌 손명완은 다양한 경험에서 얻은 흔들리지 않는 투자 철학과 성공 비결을 들려준다."
2,한국형 탑다운 투자 전략 (이베스트 리서치의 주식 투자 레벨 업 프로젝트),https://search.shopping.naver.com/book/catalog/38292294619,https://shopping-phinf.pstatic.net/main_3829229/38292294619.20230919123444.jpg,윤지호^신중호^최광혁^정다운^최진영,24300,에프엔미디어,20230228,9791188754779,"한번 익혀두면 평생 써먹을 탑다운 투자 전략의 교과서
주요 경제지표를 활용하는 솔루션이 가득한 실전 지침서

한국의 기업과 주식시장을 둘러싼 경제의 큰 흐름을 읽고 이를 바탕으로 한 실전 투자 전략을 제시하는 책. 현직 증권사 리서치센터의 베테랑 애널리스트들이 작심하고 개인 투자자에게 탑다운(top-down, 하향식) 투자 기법의 전반을 조목조목 알려주는 첫 시도다. 탑다운 투자는 기업 분석에 집중하는 바텀업(bottom-up, 상향식)에 익숙한 이들에겐 낯설지만 한번 익혀두면 평생 써먹을 수 있는 유용한 기법으로 점점 더 주목받고 있다.

책은 탑다운 투자자가 알아야 할 핵심 경제지표와 활용법 등을 담았다. 독자가 마켓 사이클을 읽고, 경제 분석과 원자재 데이터를 통해 경제와 상품시장의 온도를 측정한 다음 퀀트 리서치에 기반해 효과적인 투자 전략을 실행할 수 있게 하는 것이 목적이다. 책이 제시한 방법론을 익히면 투자의 맥을 짚고, 그에 따라 비중을 조절하며, 극단적 심리에 휩쓸리지 않을 수 있다.

투자는 단적으로 말해 현금을 들고 좋은 기회가 올 때까지 인내하는 사람이 이기는 게임. 이 책은 “그 좋은 투자 기회를 알아채는 실력을 길러주는 책”(김철광 ‘김철광TV’ 운영자)이며 “경기에 민감한 한국 시장에서 다양한 투자 아이디어를 발굴하도록 돕는 책”(정채진 《마이클 모부신 운과 실력의 성공 방정식》 역자)이다. 

책은 또 “사례가 풍부한 탑다운 투자 전략의 교과서”(김학균 신영증권 리서치센터장)이자 “경제지표를 활용하는 솔루션이 가득한 실전 지침서”(김한진 삼프로TV 이코노미스트)로 평가받는다. 박세익 체슬리투자자문 대표는 “이 책을 회사 신입사원 교육 교재로 삼을 것”이라며 “투자의 기본기를 제대로 쌓으려면 이 책으로 시작하라”고 말했다."
3,허영만의 3천만원 2: 타이밍을 잡아라 (왕초보 허영만의 주식투자 도전기),https://search.shopping.naver.com/book/catalog/32440952910,https://shopping-phinf.pstatic.net/main_3244095/32440952910.20230920073135.jpg,허영만,12510,가디언,20180330,9788994909097,"고수들의 투자 노하우가 고스란히 그려지다.

금과옥조 주식 격언과 함께 투자금 3천만원이 성장하는 과정을 그대로 그려낸 본격 주식투자 지침서! 자신의 돈 3000만원을 직접 투자하며 그려낸 생생한 이야기가 담겨 있다. 과연 투자란 무엇인가. 식객, 타짜 등 명작을 완성시킨 저자 허영만은 '투자'의 세계를 직접 경험하기에 이른다. 주식투자 전문가들의 자문을 받아, 자신의 실제 돈을 직접 투자하여 현실성을 더했다.

1권 수익률을 상회하는 2권의 수익률은? 2권에서 눈여겨볼 가장 큰 변화는 투자자문단의 변화다. 개인투자자와 투자자문회사, 로보어드바이저 등 다섯 명으로 구성되었던 자문단에, 가치투자의 고수로 널리 알려진 ‘남산주성’ 김태석 자문위원이 합류하여 전체 자문단은 여섯 명으로 늘었다. 지속적인 상승세를 보였던 코스피와 코스닥 시장의 호조, 최근 다우지수의 급락에 이르기까지의 상황 속에서 각 자문단의 추천 종목과 시장에 대한 분석, 매매 스타일의 차이를 지켜보는 것도 재미를 더한다."
4,토큰증권(큰글자책),https://search.shopping.naver.com/book/catalog/38522383618,https://shopping-phinf.pstatic.net/main_3852238/38522383618.20230808084259.jpg,이건호,22500,커뮤니케이션북스,20230315,9791128896842,"금융위원회는 2023년 2월 6일 '토큰증권 발행·유통 규율체계 정비방안'을 발표한 데 이어 3월 6일에는 전자증권법과 자본시장법 개정안을 2023년 상반기에 국회에 제출하겠다고 밝혔다. 토큰증권은 빠르면 2024년 발행 유통될 전망이다. 토큰증권은 현실 세계의 자산(RWA, real world asset)을 토큰화한 것이다. 토큰화는 분산원장기술 기반의 디지털화를 의미한다. '토큰증권' 본격 시행에 앞서 그 실체와 의의, 우려와 기대, 문제점과 대책 등을 세밀하게 들여다본다."
5,"허영만의 3천만원 3: 매수는 기술, 매도는 예술 (왕초보 허영만의 주식투자 도전기)",https://search.shopping.naver.com/book/catalog/32436264688,https://shopping-phinf.pstatic.net/main_3243626/32436264688.20230913070958.jpg,허영만,12510,가디언,20180703,9791189159047,"만화가 허영만이 3천만원의 종잣돈으로 직접 투자에 도전했다. 
흥미진진한 투자 과정과 결과, 시시각각 변하는 주식시장의 흐름과 대처방법을 
생생하게 중계하는 최초의 현장 주식 만화. 

실제 투자 과정 담아낸 참신한 시도로 호평
국내 최초의 실전 주식 만화 《허영만의 3천만원》3권이 단행본으로 출간되었다.《허영만의 3천만원》은 《타짜》《식객》《꼴》 등 명작을 탄생시킨 허영만 화백이 다섯 명의 주식투자 전문가에게 자문을 받아 실제로 자신의 돈 3천만원을 투자하면서 일어나는 과정과 결과를 그린 웹툰이다. 2017년 7월 31일부터 인터넷서점 예스24가 운영하고 있는 문화 웹진 ‘채널예스’를 통해 매주 화요일에 연재되고 있으며, 네이버 삼성증권 포스트와 한국경제TV 와우넷, 증권 포털 팍스넷에서도 최신 화를 만나볼 수 있다. 이번에 출간된 3권은 앞서 출간된 1, 2권에 이어 2018년 2월에서 4월까지의 투자 내용을 담은 연재분을 모은 것이다. 
이 작품은 특정 캐릭터가 이야기를 이끄는 전통적인 만화의 틀을 깬 참신한 시도와 2주의 시차를 두고 실제 투자 과정을 가감 없이 담아낸 내용으로 독자들에게 많은 관심을 모으고 있다. 앞서 출간된 1, 2권 역시 출간 즉시 베스트셀러 순위에 오르며 많은 독자들로부터 호평을 받았다."
6,허영만의 3천만원 세트 (왕초보 허영만의 주식투자 도전기),https://search.shopping.naver.com/book/catalog/32492741832,https://shopping-phinf.pstatic.net/main_3249274/32492741832.20240712071859.jpg,허영만,50040,가디언,20180917,9788994909066,"최초의 시도, 실제 투자를 통해 전달하는 리얼한 주식시장 이야기

국내 최초의 실전 주식 만화 『허영만의 3천만원』(총 4권)이 세트로 출간되었다.『허영만의 3천만원』은 『타짜』『식객』『꼴』 등 명작을 탄생시킨 허영만 화백이 다섯 명의 주식투자 전문가에게 자문을 받아 실제로 자신의 돈 3천만원을 투자하면서 일어나는 과정과 결과를 그린 웹툰이다. 인터넷서점 예스24가 운영하고 있는 문화 웹진 ‘채널예스’를 통해 2017년 7월 31일부터 매주 화요일에 연재되었고, 약 13개월이 지난 2018년 8월 28일로 마무리되었다. 이를 묶은 단행본도 4권을 마지막으로 시리즈를 마감하게 되었다. 

이 작품은 특정 캐릭터가 이야기를 이끄는 전통적인 만화의 틀을 깬 참신한 시도와 2주의 시차를 두고 실제 투자 과정을 가감 없이 담아낸 내용으로 많은 독자들로부터 호평을 받았다. 5인의 투자자문단이 추천하는 종목과 매매 스타일의 차이, 다양한 관점을 볼 수 있는 것도 특징이다."
7,"허영만의 3천만원 4 (여의도의 타짜들, 완결)",https://search.shopping.naver.com/book/catalog/32456882736,https://shopping-phinf.pstatic.net/main_3245688/32456882736.20240718072256.jpg,허영만,12510,가디언,20180917,9791189159092,"국내 최초의 실전 주식 만화 《허영만의 3천만원》은 허영만 화백이 다섯 명의 주식투자 전문가에게 자문을 받아 실제로 자신의 돈 3천만원을 투자하면서 일어나는 과정과 결과를 그린 웹툰이다.이번에 출간된 4권은 앞서 출간된 1, 2, 3권에 이어 2018년 5월에서 8월까지의 투자 내용을 담은 연재분을 모은 것이다. 



4권에는 그동안 이어졌던 주식 관련 격언.금언의 소개와 함께 주식투자에서의 성공으로 이름이 알려진 투자가들의 스토리를 실었다. ‘여의도의 타짜들’이라는 제목으로 ‘주식농부’로 알려진 박영옥 씨와 이태이 씨의 이야기가 저자와의 인터뷰를 통해 펼쳐진다. 



《허영만의 3천만원》은 연재가 마무리되며 단행본 4권을 마지막으로 시리즈를 끝맺게 되었다. 주식 문외한으로 시작했던 허 화백은 이제 스스로 “반쯤 실눈을 뜬” 것 같다고 말한다. 또, 연재는 끝났지만 그동안 모아뒀던 노후자금의 일부를 안전한 주식에 담아 놓을 예정이라고 밝혔다. 



무엇보다 그는 독자에게 ’대박’이나 엄청난 ‘뻥튀기’를 기대하지 말 것이며, 빚을 내거나 당장 써야 할 용도가 있는 돈으로는 절대 투자하지 말라는 것이다. 투기가 아닌 투자의 한 방법으로 주식에 대해 공부하고 차분하게 접근할 것을 당부한다."
8,주식유치원에서 배우는 해외주식 기초수업 (해외주식 투자의 기본과 개별종목 및 ETF 실전투자 전략까지),https://search.shopping.naver.com/book/catalog/38855370618,https://shopping-phinf.pstatic.net/main_3885537/38855370618.20230829085525.jpg,주식유치원(김석민),16200,책밥,20230403,9791190641951,"상승장이 있으면 하락장이 있는 것이 주식시장 불변의 법칙!! 
지금이 바로 제2의 애플과 아마존을 찾기 위한 공부를 시작할 때

세계에서 주식투자로 가장 큰 자산을 이룬 워런 버핏에게 아마존 창업자 제프 베이조스가 물었다. “당신의 투자 철학은 굉장히 간단합니다. 그런데 왜 사람들은 당신이 하는 것을 그대로 따라 하지 않을까요?” 이 물음에 워런 버핏은 이렇게 답했다고 한다. “아무도 천천히 부자가 되기를 원하지 않으니까요.”

주식에 투자하는 사람들은 모두 투자로 큰돈을 벌고 싶어 한다. 하지만 단기간 큰돈을 벌고 싶은 마음에 남의 말만 듣고 무작정 투자하는 대부분의 투자자들은 실패하고 만다. 이는 워런 버핏의 말처럼 모두가 빨리 돈을 벌 수 있는 투자처만 찾기 때문일 것이다. 주식시장의 내외부환경이나 산업 또는 기업에 대한 기본적인 공부 없이 지금 당장 주가 상승이 돋보이는 기업, 단기간에 2배로 상승할 기업만을 찾은 까닭일 것이다.

투자는 하루아침에 끝나는 과정이 아니라 평생을 함께하는 과정이라고 한다. 장기간 투자에서 좋은 성과를 내기 위해서는 무엇보다 기본 원칙을 갖고 관심 기업에 대해 꾸준히 공부하는 것이 필요하다. 유튜브 채널 〈주식유치원_야너주〉를 운영하는 작가는 주식에 대한 기초를 다룬 전작에 이어 이번에는 좀 더 넓은 투자 시장으로의 도약을 위해 《주식유치원에서 배우는 해외주식 기초수업》을 통해 독자들에게 국내주식과는 또 다른 해외주식의 기초와 실전투자 전략까지 쉽고 상세하게 설명해주고 있다."
9,이렇게 쉬운데 왜 주식 투자를 하지 않았을까 (주식 계좌개설부터 평생 가는 가치투자자까지 한권에 담은 주식투자가이드),https://search.shopping.naver.com/book/catalog/32441520624,https://shopping-phinf.pstatic.net/main_3244152/32441520624.20221019114112.jpg,곽병열,16200,한스미디어,20220330,9791160077797,"누구나, 손쉽게, 지금 당장
시작할 수 있는 주식 입문 공부

주식 투자는 어떻게 시작하는 것인지
궁금한 모든 주린이들을 위해

『이렇게 쉬운데 왜 주식 투자를 하지 않았을까』는 한스미디어에서 2021년 11월에 런칭한 투자 입문서 시리즈 〈이 쉬운 시리즈〉의 두 번째 책이다. 입문자도 편하게 읽을 수 있는 쉬운 서술을 바탕으로 한 기초 지식부터 실제로 적용해볼 만한 투자 전략 그리고 독자가 내용을 얼마나 이해했는지 스스로 점검해볼 수 있는 정리문제까지 구성되어 좋은 반응을 얻었던 첫 책 『이렇게 쉬운데 왜 부동산 투자를 하지 않았을까』와 비슷한 구성으로 출간된 이 책은 KB증권과 하나은행, 현재 리딩투자증권까지 여의도 증권가에서 오랜 시간 동안 몸담아 온 저자 곽병열 이사가 주식 투자 전반에 대해서 입문자들을 위해 집필한 기초서다. 2020년에 『나는 배당투자로 한 달에 두 번 월급 받는다』를 통해서 투자서 독자들에게 긍정적인 평가를 받은 바 있는 저자는 이번 책에서는 특정 분야를 넘어서 주식 투자의 전반에 대한 기초적 지식부터 실전 투자 방법, 그리고 전체 시장의 흐름에 대한 본인의 생각까지 곁들여서 독자에게 전달한다."
0,전략적 가치 투자 (Value Timer의),https://search.shopping.naver.com/book/catalog/32490365023,https://shopping-phinf.pstatic.net/main_3249036/32490365023.20220527033749.jpg,신진오,48800,이콘,20090410,9788990831682,"<b>가치투자의 새로운 방향을 모색한다. </b>
<b>가치투자의 이론과 경험을 겸비한 저자의 가치 투자 운용법</b>

증권회사에서 오랜 기간 채권과 주식운용을 담당한 저자, 신지오가 쓴 가치 투자 실전 보고서. 이 책은 우량주를 선별하고 다수의 종목에 동시에 투자하는 포트폴리오 관리 전략인 가치투자 전략과 전체 투자 자산 중에서 주식 투자 규모를 조절하는 베타투자 전략을 소개한다. 

저자는 가장 바람직한 투자 방법은 가치투자 전략으로 구성된 우량주의 포트폴리오를 대상으로 하여, 그 투자 규모를 베타투자 전략에 근거하여 조절하는 것이라 조언한다. 주식 투자 시기, 종목 선정, 상승 주도주, 가치 우량주 등 주식 투자의 기본 이론부터 시작해 베타투자 전략, 가치투자 전략, 전략적 가치투자에 이르기까지 저자의 오랜 경험을 바탕으로 도표를 분석해 알기 쉽게 설명하고 있다."
1,사위에게 알려주는 주식 노하우,https://search.shopping.naver.com/book/catalog/39188560619,https://shopping-phinf.pstatic.net/main_3918856/39188560619.20230920071622.jpg,김병호,15300,디자인21,20230406,9788961311090,"이 책은 기존의 복잡하고 어려운 주식 이론서가 아닙니다. 초보 투자자들이 쉽게 접근하여 바로 수익을 낼 수 있도록 꼭 알아야 할 사항들만 모아서 아주 쉽게 설명한 실전 투자용 안내서입니다. 필자의 30년 투자 경험을 바탕으로 집필하여 다른 책이나 인터넷 사이트에서는 쉽게 접할 수 없는 투자 노하우와 많은 정보들이 실려 있습니다. 특히 단기 투자에는 결정적인 도움을 줄 것입니다.
프라이버시가 손상될 것 같아 많이 망설였지만 독자분들에게 신뢰를 드리기 위해 부록에 필자의 실제 데이트레이딩 내역서를 실었습니다. 거래 내역서를 보면 아시겠지만 필자는 1,000만 원 내외의 자금으로 주식투자를 합니다. 부담 없는 금액이므로 마음 편하게 오락 게임을 하듯이 즐기면서 합니다. 또한 매달 10~40%의 수익을 올리고 있습니다. 어쩌다 한 번이 아니라 매달 꾸준하게이 정도의 수익을 올립니다. 장이 좋든 나쁘든 큰 영향을 받지 않습니다. 오히려 장이 나쁠 때가 수익을 올리기가 더 쉽습니다. 독자들은 약간 의아해하겠지만 이 책을 끝까지 다 읽으면 무슨 말인지 저절로 알게 될 것입니다."
