,title,originallink,link,description,pubDate
9,KODEX 타겟프리미엄 ETF 시리즈 3종 순자산 5천억원 돌파,https://www.ngetnews.com/news/articleView.html?idxno=509370,https://www.ngetnews.com/news/articleView.html?idxno=509370,"AI산업 성장에 따른 수혜가 기대되는 미국AI테크주, 미국<b>금리</b>인하 시 자본차익이 기대되는 미국30년국채, SCHD ETF로 잘 알려진 미국배당성장주 등 다양한 자산군으로 설계됐다. 각자의 선호와 시장전망에 맞춰... ","Mon, 22 Jul 2024 17:26:00 +0900"
0,힘 좋은 건·조·기…코스피 흔들려도 굳건,https://www.hankyung.com/article/2024072211501,https://n.news.naver.com/mnews/article/015/0005012863?sid=101,그러나 <b>금리</b> 인하와 우크라이나 재건 테마 흐름을 타고 최근 매수세가 살아나고 있다. <b>금리</b> 인하 정도에 따라 리스크 요인인 프로젝트파이낸싱(PF) 부실도 완화될 수 있다는 분석이 제기된다. 이웅찬 하이투자증권... ,"Mon, 22 Jul 2024 17:26:00 +0900"
1,"달러-엔, 156엔대로 속락…유럽 개장 앞두고 위험 회피",https://news.einfomax.co.kr/news/articleView.html?idxno=4318084,https://news.einfomax.co.kr/news/articleView.html?idxno=4318084,또한 이달 말 예정된 일본은행(BOJ) 금융정책결정회의에서 국채 매입 감액계획과 함께 추가 <b>금리</b> 인상이 단행될 것이란 기대도 추가로 반영돼 엔화를 지지하고 있다. syyoon@yna.co.kr 본 기사는 인포맥스 금융정보... ,"Mon, 22 Jul 2024 17:26:00 +0900"
2,"[오늘의 시황] 코스피, 전장 대비 1.14% 내린 2763.51",http://www.goodkyung.com/news/articleView.html?idxno=242485,http://www.goodkyung.com/news/articleView.html?idxno=242485,전일대비 -657억원) &lt;<b>금리</b>&gt; - 국고채 : 10년물 3.186%(전일대비 +0.03%포인트) - 국고채 : 3년물 3.109%(전일대비 +0.035%포인트) &lt;환율&gt; - 원달러 : 1387.90원(전일대비 +1.20원) - 원엔 : 887.43원(전일대비 +3.... ,"Mon, 22 Jul 2024 17:26:00 +0900"
3,"플루토스, 초고<b>금리</b> CB '액면가' 리픽싱...&quot;재무·주가 이중고&quot;",http://www.ftoday.co.kr/news/articleView.html?idxno=325660,http://www.ftoday.co.kr/news/articleView.html?idxno=325660,"리더스 기술투자에서 상호변경한 플루토스가 고<b>금리</b> 전환사채(CB)의 이자 부담에 더해 주가 측면의... 당장은 시가가 전환가를 하회하고 있는 만큼 주가 측면의 리스크가 부각되고 있지는 않지만, 사채의 <b>금리</b>가 매우... ","Mon, 22 Jul 2024 17:26:00 +0900"
4,"[함께가자 우리ESG] MG새마을금고, 집중호우 피해복구 금융지원 나서",http://www.newslock.co.kr/news/articleView.html?idxno=94554,http://www.newslock.co.kr/news/articleView.html?idxno=94554,"긴급자금 대출 시 최고 2%의 범위 내에서 금고별 상황에 따라 우대<b>금리</b> 적용이 가능하며, 수해 피해 고객에게 피해복구를 위한 실질적인 도움이 될 것으로 기대된다. 또한 기존 대출고객에 대한 금융지원으로는 대출... ","Mon, 22 Jul 2024 17:24:00 +0900"
5,김병환 &quot;자영업자 상환유예 추가 검토…PF시행사 자본비율 강화&quot;,http://news.bizwatch.co.kr/article/finance/2024/07/22/0035,https://n.news.naver.com/mnews/article/648/0000027526?sid=101,"생각한다&quot;며 &quot;특히 <b>금리</b>인하와 관련해 금융위가 기획재정부, 한국은행과 협의해서 적극적으로 주도할 필요가... 이에 대해 김병환 후보자는 &quot;(지난해는) 부동산 시장 상황을 고려했던 것으로 본다&quot;며 &quot;작년은 고<b>금리</b>가... ","Mon, 22 Jul 2024 17:23:00 +0900"
6,채권개미도 꽂혔다…'월배당 회사채' 봇물,https://www.hankyung.com/article/2024072211181,https://n.news.naver.com/mnews/article/015/0005012857?sid=101,한 대형 증권사의 채권 발행 담당자는 “매달 안정적 현금 흐름을 원하는 채권개미가 월 지급식 채권을 주로 찾는다”며 “은행 예금보다 높은 <b>금리</b>를 누릴 수 있다는 점이 매력적”이라고 말했다.,"Mon, 22 Jul 2024 17:23:00 +0900"
7,[경제PICK] 2분기 '마이너스 성장' 우려 확산...소비가 관건,https://www.ytn.co.kr/_ln/0102_202407221722472801,https://n.news.naver.com/mnews/article/052/0002064514?sid=101,"설비 투자는 최근 들어서 고물가, 고<b>금리</b> 등등 여러 가지 불확실성이 있기 때문에 여전히 좋지 않은 부분이 있습니다. 소비는 물가가높고 <b>금리</b>가 여전히 높은 부분이 여전히 소비를 제약하고 있는 부분이 있습니다.] 내수... ","Mon, 22 Jul 2024 17:22:00 +0900"
8,"신한은행, 중소기업 위한 '디지털 신용보증 팩토링' 상품 출시",http://www.newscape.co.kr/news/articleView.html?idxno=104049,http://www.newscape.co.kr/news/articleView.html?idxno=104049,"낮은 <b>금리</b>가 적용되며 구매기업에 대한 신용평가도 생략할 수 있게 돼 절차가 간편해졌다. 신한은행 관계자는 &quot;테크핀레이팅스, 서울보증보험과의 협업을 통해 기업들이 비대면 플랫폼 상에서 편리하게 낮은 <b>금리</b>로... ","Mon, 22 Jul 2024 17:22:00 +0900"
9,"국고채 <b>금리</b>, '바이든 사퇴' 혼란에도 모두↓…3년물 3.071%(종합)",https://www.yna.co.kr/view/AKR20240722133551008?input=1195m,https://n.news.naver.com/mnews/article/001/0014821853?sid=101,국고채 <b>금리</b>는 일제히 내리며 강세 마감했다. 이날 서울 채권시장에서 3년 만기 국고채 <b>금리</b>는 전 거래일보다 0.3bp(1bp=0.01%포인트) 내린 연 3.071%에 장을 마쳤다. 10년물 <b>금리</b>는 연 3.145%로 1.1bp 하락했다. 5년물과... ,"Mon, 22 Jul 2024 17:21:00 +0900"
0,"새마을금고, 집중호우 피해복구 금융지원 나서",https://www.thepublic.kr/news/articleView.html?idxno=230406,https://www.thepublic.kr/news/articleView.html?idxno=230406,"긴급자금 대출 시 최고 2%의 범위 내에서 금고별 상황에 따라 우대<b>금리</b> 적용이 가능하며, 수해 피해 고객에게 피해복구를 위한 실질적인 도움이 될 것으로 기대된다. 또한 기존 대출고객에 대한 금융지원으로는 대출... ","Mon, 22 Jul 2024 17:20:00 +0900"
1,"中, 기준<b>금리</b> 깜짝 인하…&quot;빅뱅 아닌 리틀뱅&quot; [종합]",https://biz.sbs.co.kr/article_hub/20000183007?division=NAVER,https://n.news.naver.com/mnews/article/374/0000393937?sid=104,중국이 시장 기대치를 밑돈 2분기 경제성장률 성표를 받아 들고 '사실상의 기준<b>금리</b>'인 대출우대<b>금리</b>(LPR)를 5개월 만에 인하하며 유동성 공급에 나섰습니다. 중국 중앙은행인 중국인민은행은 22일... ,"Mon, 22 Jul 2024 17:20:00 +0900"
2,"MG새마을금고, 집중호우 피해지역 고객 금융지원",https://www.job-post.co.kr/news/articleView.html?idxno=110092,https://www.job-post.co.kr/news/articleView.html?idxno=110092,"긴급자금 대출 시 최고 2% 범위내에서 금고별 상황에 따라 우대<b>금리</b> 적용이 가능하다. 또 기존 대출고객에 대한 금융지원으로는 대출 만기연장의 경우 최대 1년, 원리금에 대한 상환유예는 6개월의 범위 내에서 이뤄진다.... ","Mon, 22 Jul 2024 17:20:00 +0900"
3,카카오뱅크 '저금통with메가박스' 출시,http://www.m-i.kr/news/articleView.html?idxno=1142391,http://www.m-i.kr/news/articleView.html?idxno=1142391,이번 상품은 제휴를 통해 <b>금리</b> 외에 추가 혜택을 담아 선보이는 5번째 '브랜드저금통'으로 '저금통with메가박스'에 가입한 고객은 연 8%의 <b>금리</b>와 함께 메가박스의 다양한 혜택을 함께 즐길 수 있다.... ,"Mon, 22 Jul 2024 17:20:00 +0900"
4,"Sh수협은행, 저출생 극복 지원 공익상품 '아가야환영海적금' 출시",https://www.thepublic.kr/news/articleView.html?idxno=230394,https://www.thepublic.kr/news/articleView.html?idxno=230394,Sh수협은행은 저출생 극복 지원을 위해 최고 연 8% <b>금리</b>를 제공하는 공익상품 '아가야환영海적금'을 신규... 아가야환영海적금은 기본<b>금리</b> 연 3%에 우대<b>금리</b> 조건을 충족하면 임신‧출산‧다자녀에게 최고 연 8%의 <b>금리</b>를... ,"Mon, 22 Jul 2024 17:20:00 +0900"
5,"카카오뱅크, '저금통with메가박스' 출시",https://www.job-post.co.kr/news/articleView.html?idxno=110090,https://www.job-post.co.kr/news/articleView.html?idxno=110090,이번 상품은 5번째 '브랜드저금통'으로 '저금통with메가박스'에 가입한 고객은 연 8%의 <b>금리</b>와 함께 최대 2만원 상당의 혜택도 주어진다. 한 번만 저금해도 최대 2명까지 쓸 수 있는 인당 3000원 할인 쿠폰이 주어진다.... ,"Mon, 22 Jul 2024 17:20:00 +0900"
6,"HD현대인프라코어, 2Q 영업익 815억…전년比 49.7%↓",https://www.topdaily.kr/articles/98292,https://www.topdaily.kr/articles/98292,"HD현대인프라코어는 하반기 북미를 비롯한 선진시장에서 <b>금리</b> 인하와 인프라 투자 확대, 리쇼어링 정책 등이 본격화하면 건설장비 시장이 회복세를 보일 것으로 전망했다. 브라질, 인도네시아 등 신흥시장에서는... ","Mon, 22 Jul 2024 17:20:00 +0900"
7,"“작년이 너무 좋았나”…HD현대인프라, 영업익 '반토막'",http://news.bizwatch.co.kr/article/industry/2024/07/22/0036,https://n.news.naver.com/mnews/article/648/0000027525?sid=101,"다만 하반기부터 미국의 인프라 투자 프로젝트의 본격 개시와 9월 <b>금리</b> 인하 가능성 등 시장환경 개선... 북미를 비롯한 선진시장에서 하반기부터 <b>금리</b> 인하와 인프라 투자 확대, 리쇼어링(제조업의 본국 회귀) 정책 등이... ","Mon, 22 Jul 2024 17:19:00 +0900"
8,&quot;기대인플레 편차 심하면 통화정책 효과 약화&quot;,http://www.fntoday.co.kr/news/articleView.html?idxno=327568,http://www.fntoday.co.kr/news/articleView.html?idxno=327568,"예를 들어 한은의 <b>금리</b> 인상을 향후 경제가 탄탄할 것이라는 신호로 민간 경제주체들이 받아들이면, 인플레이션과 기대인플레이션이 일반적 긴축 효과와 다르게 오히려 높아질 수도 있다는 얘기다. 심 과장은... ","Mon, 22 Jul 2024 17:18:00 +0900"
9,"中, 기준<b>금리</b> 0.1%p 인하해 유동성 공급…경기부양 긴급함 보여줘",https://www.newsworks.co.kr/news/articleView.html?idxno=759938,https://www.newsworks.co.kr/news/articleView.html?idxno=759938,중국이 '사실상의 기준<b>금리</b>'인 대출우대<b>금리</b>(LPR)를 5개월 만에 인하하며 유동성 공급에 나섰다. 22일 신화통신에 따르면 이날 중국 중앙은행인 중국인민은행은 주택담보대출 기준 역할을 하는 5년물 LPR을 3.85%로... ,"Mon, 22 Jul 2024 17:18:00 +0900"
0,"메리츠증권, 신임 사장 선임에 투톱 체제로 전환...PF 비중 덜까",https://www.megaeconomy.co.kr/news/newsview.php?ncode=1065599155602717,https://www.megaeconomy.co.kr/news/newsview.php?ncode=1065599155602717,"지속되는 <b>금리</b> 상승기에도 선제적 유동성 확보와 리스크 관리로 안정적 실적을 내며 메리츠증권의 트레이딩 부문을 한 단계 끌어올렸다고 평가받는다. 메리츠금융그룹은 장원재 메리츠증권 S&amp;T·리테일대표, 김중현... ","Mon, 22 Jul 2024 17:16:00 +0900"
1,"日 장기국채, 전강후약…바이든 사퇴+BOJ 경계",https://news.einfomax.co.kr/news/articleView.html?idxno=4318083,https://news.einfomax.co.kr/news/articleView.html?idxno=4318083,"일본 장기<b>금리</b>가 소폭 상승했다. 조 바이든 미국 대통령의 차기 대통령 선거 후보 사퇴로 하락 출발했다가, 일본은행(BOJ)의 테이퍼링(자산매입 축소) 경계감으로 상승했다. 22일 연합인포맥스 해외<b>금리</b> 현재가... ","Mon, 22 Jul 2024 17:16:00 +0900"
2,"MG새마을금고, 집중호우 피해복구 금융지원",http://www.iminju.net/news/articleView.html?idxno=105027,http://www.iminju.net/news/articleView.html?idxno=105027,"긴급자금 대출 시 최고 2%의 범위 내에서 금고별 상황에 따라 우대<b>금리</b> 적용이 가능하다. 또한 기존 대출고객에 대한 금융지원으로는 대출 만기연장의 경우 최대 1년, 원리금에 대한 상환유예는 6개월의 범위 내에서... ","Mon, 22 Jul 2024 17:16:00 +0900"
3,"HD현대인프라코어, 2분기 영업이익 49% 감소…&quot;근원 경쟁력 강화할 것&quot;",https://www.econovill.com/news/articleView.html?idxno=661186,https://www.econovill.com/news/articleView.html?idxno=661186,"하반기부터는 북미를 비롯한 선진시장에서 <b>금리</b> 인하와 인프라 투자 확대, 리쇼어링 정책 등이 본격화되면 시장이 회복세를 보일 것으로 전망된다. 신흥시장 또한 브라질과 인도네시아를 비롯한 국가들에서 인프라... ","Mon, 22 Jul 2024 17:16:00 +0900"
4,"NH농협은행, 가계대출 급증에 주담대 <b>금리</b> 0.2%p 인상",https://biz.chosun.com/stock/finance/2024/07/22/WFRVENJIEBBETFWD2VESCWNEWQ/?utm_source=naver&utm_medium=original&utm_campaign=biz,https://n.news.naver.com/mnews/article/366/0001006573?sid=101,NH농협은행이 가계대출 총량 관리를 위해 대출 <b>금리</b>를 인상한다. 22일 금융권에 따르면 NH농협은행은 오는 24일부터 대면 주택담보대출 주기형·혼합형 상품의 <b>금리</b>를 현행보다 0.2%포인트(p) 각각 인상하기로... ,"Mon, 22 Jul 2024 17:16:00 +0900"
5,&quot;단타 매매 부담&quot;…제주 1년 이내 부동산 매도 비율 최저치,http://www.jejunews.com/news/articleView.html?idxno=2212401,http://www.jejunews.com/news/articleView.html?idxno=2212401,"이는 <b>금리</b> 인상 등의 부담을 견디며 침체기에 매입한 물건에 대한 보유 기간이 상대적으로 길어졌기... 이와 관련, 김은선 직방 빅데이터랩실 랩장은 &quot;고<b>금리</b> 시장을 견디고 남은 수요자들은 하방 압력에 버티려는... ","Mon, 22 Jul 2024 17:16:00 +0900"
6,"[<b>금리</b>인하가 온다] 끝이 보이는 물가와 싸움, 파월 이창용 4년 만에 '피벗' 눈...",https://www.businesspost.co.kr/BP?command=article_view&num=359729,https://www.businesspost.co.kr/BP?command=article_view&num=359729,"기대감만 일던 기준<b>금리</b> 인하가 드디어 눈앞으로 다가왔다. 시장은 9월 미국 연준, 10월 한국은행의 <b>금리</b> 인하를 기정사실로 받아들이고 있다. 미국 연준과 한국은행이 <b>금리</b>를 내린 것은 각각 2020년 3월과 2020년 5월이... ","Mon, 22 Jul 2024 17:14:00 +0900"
7,"경기도, 수해 피해 기업 위한 특별경영자금 200억 원으로 확대",https://www.mhns.co.kr/news/articleView.html?idxno=615875,https://www.mhns.co.kr/news/articleView.html?idxno=615875,"융자 조건은 1년 거치 3년 균등분할 상환이며, 융자 <b>금리</b>는 중소기업의 경우 은행 대출<b>금리</b>에서 1.5%, 소상공인은 2%의 이자를 경기도가 고정 지원한다. 경기도는 이 외에도 수해와 화재 등 재해 피해를 입은 기업을... ","Mon, 22 Jul 2024 17:14:00 +0900"
8,"'영업익 반토막' HD현대인프라코어, '신흥·북미' 주력해 수익성 높인다",http://news.mt.co.kr/mtview.php?no=2024072215425575495,https://n.news.naver.com/mnews/article/008/0005067123?sid=101,"실적 악화 배경으로는 <b>금리</b>인하 지연, 우크라이나 전쟁 장기화 등에 따른 글로벌 건설기계 시장의 긴축... 이어 &quot;특히 북미는 9월 <b>금리</b>인하, 트럼프 대통령 당선 기대가 커지는 것이 긍정적&quot;이라며 &quot;자사도 채널 경쟁력... ","Mon, 22 Jul 2024 17:13:00 +0900"
9,"메리츠증권, IB·리테일 키운다...장원재∙김종민 각자 대표 체제로 조직개편",http://www.newslock.co.kr/news/articleView.html?idxno=94515,http://www.newslock.co.kr/news/articleView.html?idxno=94515,지속되는 <b>금리</b> 상승기에도 선제적 유동성 확보와 리스크 관리로 안정적 실적을 내며 메리츠증권의 트레이딩 부문을 한단계 끌어올렸다고 평가 받는다. 메리츠증권 관계자는 &quot;2명의 각자 대표는 금융투자업계 최고의... ,"Mon, 22 Jul 2024 17:12:00 +0900"
0,“서울 집값 오르니 버티자”… 1년 이내 부동산 단기 매도 비율 크게 줄어,http://www.segye.com/newsView/20240722515222?OutUrl=naver,https://n.news.naver.com/mnews/article/022/0003953068?sid=101,김은실 직방 랩장 “<b>금리</b> 인하 가능성 커져” 21일 서울 중구 남산에서 서울시내 아파트 단지가 보이고... 이처럼 단기 매도 비율이 줄어든 것은 <b>금리</b> 인상 등의 부담을 견디며 침체기에 매입한 물건에 대한 보유... ,"Mon, 22 Jul 2024 17:12:00 +0900"
1,낡은 민법·형법 뜯어고친다…법무부 3번째 도전 성공할까,http://www.edaily.co.kr/news/newspath.asp?newsid=03247206638957144,https://n.news.naver.com/mnews/article/018/0005795189?sid=102,"당사자간의 약정이 없는 경우 채권의 이자율을 연 5%로 정한 고정이율 방식의 법정이율이 ‘한국은행 기준<b>금리</b>, 시중은행 평균<b>금리</b>’ 등을 고려한 변동이율 방식으로 바뀐다. ‘궁박(窮迫)’ 등 일본식 표현은 보다... ","Mon, 22 Jul 2024 17:11:00 +0900"
2,"[마켓인]태영건설68 담은 '야수의 심장' 채권개미, 이자 받으려면?",http://www.edaily.co.kr/news/newspath.asp?newsid=02833926638957144,https://n.news.naver.com/mnews/article/018/0005795187?sid=101,"태영건설은 개인투자자들에게 채권의 50% 출자 전환, 만기 3년 연장, 연 2.59%인 쿠폰 <b>금리</b>를 3% 인상하는 방안을 제시했다. 이후 출석 사채권자 3분의 2 이상 동의를 얻어 연장안이 통과된 바 있다. 태영건설68은 지난... ","Mon, 22 Jul 2024 17:09:00 +0900"
3,"신한은행, 중소기업 유동성 공급 지원 ‘디지털 신용보증 팩토링’ 출시",http://www.fnnews.com/news/202407221702424977,https://n.news.naver.com/mnews/article/014/0005216940?sid=101,"낮은 <b>금리</b>가 적용되고 구매기업의 신용평가도 생략할 수 있게 돼 절차가 간편해졌다. 신한은행 관계자는 “테크핀레이팅스, 서울보증보험과의 협업을 통해 기업들이 비대면 플랫폼 상에서 편리하게 낮은 <b>금리</b>로 이용할 수... ","Mon, 22 Jul 2024 17:09:00 +0900"
4,"메리츠증권, 장원재·김종민 각자 대표 체제로 조직개편",https://mydaily.co.kr/page/view/2024072217074082868,https://n.news.naver.com/mnews/article/117/0003853990?sid=103,지속되는 <b>금리</b> 상승기에도 선제적 유동성 확보와 리스크 관리로 안정적 실적을 내며 메리츠증권의 트레이딩 부문을 한단계 끌어올렸다고 평가 받는다. 메리츠증권 관계자는 “2명의 각자 대표는 금융투자업계 최고의... ,"Mon, 22 Jul 2024 17:09:00 +0900"
5,"삼성자산운용, 수익성·안정성 증명... 'ETF 1위' 굳건",https://www.meconomynews.com/news/articleView.html?idxno=97192,https://www.meconomynews.com/news/articleView.html?idxno=97192,"국내 시장에 상장된 총 872개의 ETF 중 순자산총액 1위 상품은 삼성자산운용의 'KODEX CD<b>금리</b>액티브(합성)... 1위는 'KODEX CD<b>금리</b>액티브(합성)'로, 해당 상품의 1년 평균거래대금은 6163억원으로 집계됐다. 업계에서는... ","Mon, 22 Jul 2024 17:08:00 +0900"
6,"[은행 &amp; NOW] KB국민은행, KB스타뱅킹에 인도네시아어 서비스 시행 등",https://www.ebn.co.kr/news/view/1630531/?sc=Naver,https://www.ebn.co.kr/news/view/1630531/?sc=Naver,이번 상품은 제휴를 통해 <b>금리</b> 외에 추가 혜택을 담아 선보이는 5번째 ‘브랜드저금통’으로 ‘저금통with메가박스’에 가입한 고객은 연 8%의 <b>금리</b>와 함께 메가박스의 다양한 혜택을 함께 즐길 수 있다.... ,"Mon, 22 Jul 2024 17:08:00 +0900"
7,"Sh수협은행, 최고 연 8% <b>금리</b> 적금상품 출시",http://www.sportsq.co.kr/news/articleView.html?idxno=468780,http://www.sportsq.co.kr/news/articleView.html?idxno=468780,Sh수협은행이 저출생 극복 지원을 위한 고<b>금리</b> 상품을 신규 출시한다. Sh수협은행은 22일 &quot;최고 연 8% <b>금리</b>를 제공하는 공익상품 '아가야환영海적금'을 신규 출시한다&quot;고 밝혔다. 수협은행 관계자는 &quot;국가적 위기인 저출생... ,"Mon, 22 Jul 2024 17:08:00 +0900"
8,"서울 집값 연이어 상승…마용성·강남, 서울 집값 상승 주도",https://www.polinews.co.kr/news/articleView.html?idxno=658391,https://www.polinews.co.kr/news/articleView.html?idxno=658391,"부동산 관계자는 &quot;시장 <b>금리</b>가 떨어지고, 정치권의 종합부동산세 인하 등의 움직임으로 인해 '똘똘한 한 채... 크게 오른 공사비와 높은 <b>금리</b>로 시공사와 조합이 갈등을 겪고 사업이 지체되고 있는 사업장이 확산되고... ","Mon, 22 Jul 2024 17:07:00 +0900"
9,"경남신보, '출연금 320억원 확보...연말 500억원 목표'",http://www.breaknews.com/1045427,http://www.breaknews.com/1045427,"또한, 경남신보는 소상공인의 <b>금리</b> 부담 완화를 위해 정책자금을 1,051억원으로 확대하고, 시,군과 협력하여 금융비용 부담을 줄이기 위한 방안도 마련하고 있다.... ","Mon, 22 Jul 2024 17:06:00 +0900"
0,상반기 상업용 부동산 거래 8조…오피스·물류센터가 시장 주도,https://www.hankyung.com/article/2024072209711,https://n.news.naver.com/mnews/article/015/0005012830?sid=101,<b>금리</b> 인하 기대로 하반기 상업용 부동산 투자가 더 활발해질 것이란 전망이 나온다. 22일 글로벌 부동산... 최수혜 CBRE코리아 리서치 총괄 상무는 “<b>금리</b> 인하 기대 속에 견고한 오피스 수요와 해외 기업의 국내... ,"Mon, 22 Jul 2024 17:05:00 +0900"
1,"[단독] 바이든 재선 포기, 달러 하락과 국채 상승 유발",https://www.gokorea.kr/news/articleView.html?idxno=801324,https://www.gokorea.kr/news/articleView.html?idxno=801324,"정책 <b>금리</b> 인하로 상승했지만, 중국 주식은 최근 주요 공산당 회의에서 강력한 경기 부양책이 부족하다는 실망감으로 하락했다. 이번 주에는 유럽의 경제 활동 데이터, 미국 2분기 성장률, 캐나다 중앙은행의 <b>금리</b> 결정에... ","Mon, 22 Jul 2024 17:04:00 +0900"
2,"경주시·한수원, 지역 중소기업에 저리로 운전자금 지원",https://www.yna.co.kr/view/AKR20240722137800053?input=1195m,https://n.news.naver.com/mnews/article/001/0014821814?sid=101,경북 경주시는 한국수력원자력과 함께 지역 중소기업을 대상으로 낮은 <b>금리</b>로 운전자금을 지원해주는 경주상생협력기금사업을 편다고 22일 밝혔다. 시는 한수원 경주상생협력기금을 활용해 1천80억원의 운전자금을... ,"Mon, 22 Jul 2024 17:03:00 +0900"
3,"한은 경남본부 &quot;지역 주택시장, 단기간 회복세 전환 어려울 듯&quot;",https://www.yna.co.kr/view/AKR20240722136000052?input=1195m,https://n.news.naver.com/mnews/article/001/0014821815?sid=102,"주택 건설 착공에 들어간 사업장 대부분이 시공 능력 평가 30위 이내 대형건설사가 시공하고, 관련 사업도 순조롭게 진행되는 것으로 파악될뿐더러 최근 시장 <b>금리</b>가 하락세로 들어서 사업 부담 완화에 도움이 될 것으로... ","Mon, 22 Jul 2024 17:03:00 +0900"
4,"음성군, 중소기업 육성자금 이차보전 지원사업 추진",http://www.newstnt.com/news/articleView.html?idxno=393559,http://www.newstnt.com/news/articleView.html?idxno=393559,"대출 <b>금리</b>의 연 2% 이내 이자를 지원한다. 특히 음성군 유망중소기업으로 선정된 기업과 인구시책에 기여한... 조병옥 군수는 &quot;지난 1차 사업 공고 시 일반기업의 대출한도는 3억원이었으나, 고<b>금리</b>·고물가·고환율 3고... ","Mon, 22 Jul 2024 17:02:00 +0900"
5,"새마을금고, 집중호우 피해복구 금융지원 나서",http://www.m-i.kr/news/articleView.html?idxno=1142379,http://www.m-i.kr/news/articleView.html?idxno=1142379,"긴급자금 대출 시 최고 2%의 범위 내에서 금고별 상황에 따라 우대<b>금리</b> 적용이 가능하며, 수해 피해 고객에게 피해복구를 위한 실질적인 도움이 될 것으로 기대된다. 또한 기존 대출고객에 대한 금융지원으로는 대출... ","Mon, 22 Jul 2024 17:02:00 +0900"
6,트럼프의 '미 우선주의'…강달러에 트럼플레이션까지,http://www.newstomato.com/ReadNews.aspx?no=1235818&inflow=N,http://www.newstomato.com/ReadNews.aspx?no=1235818&inflow=N,"연준)의 기준<b>금리</b> 인하 계획에도 영향을 줄 것으로 예상되면서 통화정책 방향도 불확실해졌는데요. 시장에서는 연준이 오는 9월 기준<b>금리</b>를 인하할 것이라는 전망이 지배적인 가운데, 트럼프 전 대통령은 오는 11월 대선... ","Mon, 22 Jul 2024 17:02:00 +0900"
