,title,link,image,author,discount,publisher,pubdate,isbn,description
1,월가의 퀀트 투자 바이블 (90년 역사로 검증한 과학적 주식투자 방법론),https://search.shopping.naver.com/book/catalog/32464884823,https://shopping-phinf.pstatic.net/main_3246488/32464884823.20230801121029.jpg,제임스 오쇼너시,31500,에프엔미디어,20211220,9791188754540,"다양한 투자 요소들이 수익에 미치는 결과 집대성
장장 90년 데이터로 검증한 과학적 주식 투자 방법론

PER, PSR, 배당수익률, 가격 모멘텀 등 널리 알려진 단일 요소부터 이들을 결합한 복합 요소까지 적용한 온갖 투자 전략의 성과를 약 90년간의 데이터로 검증해서 가장 강력한 전략을 찾는 방법을 알려주는 책. 전략들의 기간별 수익률과 변동성, 기저율 등 객관적인 자료를 제공하면서 결과를 해석하는 과정을 보여주기 때문에, 독자는 주식시장의 과거 흐름을 이해하고 현재를 적절한 맥락에서 파악할 수 있다.

저자 제임스 오쇼너시는 오쇼너시자산운용의 회장이며 미국을 대표하는 금융 전문가, 퀀트 분석의 선구자로 인정받았다. 〈포브스〉는 2009년 2월에 ‘전설적 투자자’로 벤저민 그레이엄, 워런 버핏, 피터 린치와 함께 그를 꼽았고, 〈배런스〉는 ‘세계 최강’이자 ‘통계 전문가’로 불렀다.

문병로 서울대 교수는 추천의 말에서 “지금까지 출간된 모든 계량적 분석 서적 중에서 한 권을 들라면 바로 이 책”이라며, “투자 전략이 잘 작동하지 않을 때 들춰 보면 크리스천이 성경에서 마음의 안정을 얻는 것과 비슷한 효과를 줄 것”이라고 말했다. 김동주 이루다투자일임 대표 등이 쓴 한국판 특별 부록에서는 책의 전략을 한국 시장에 적용하는 방법과 수익률 개선 방안을 차근차근 설명한다. 책을 따라가다 보면 초보자는 전략을 세우는 데 유용한 실험 결과들로 투자의 눈을 뜰 수 있고, 전문가는 팩터 투자의 시야를 한층 더 넓힐 수 있다."
2,주식시장의 승부사들 (대한민국 최고의 트레이더들이 전하는 주식투자의 비밀),https://search.shopping.naver.com/book/catalog/32456872969,https://shopping-phinf.pstatic.net/main_3245687/32456872969.20231028091728.jpg,한봉호^김형준^강창권^이주원^김영옥(데이짱),19800,이레미디어,20201005,9791188279890,"실전투자대회 입상 기록 48회 이상, 합산 우승 22회! 전설로 남을 주식투자자의 이야기 
전쟁터 같은 실전에서 자신을 증명한 최강자들에게 배우는 투자 전략, 심리컨트롤, 생존 비법

매해 증권사에서 개최하는 실전투자대회에는 전국의 내로라하는 주식투자의 고수들이 몰려 진검승부를 겨룬다. 몇백 퍼센트의 수익률은 기본이며, 어마어마한 수익금은 입을 벌어지게 만든다. 모니터 뒤에 숨어있는 사람들은 도대체 누구이며, 어떻게 매매하기에 단기간에 상상하기도 어려운 수익률로 큰 수익을 거두는 것일까? 이에 관한 명쾌한 해답을 찾기 위해 대한민국 최고의 투자 고수를 직접 찾아 나섰다. 《주식시장의 승부사들》은 실전투자대회에서 자신의 실력을 스스로 증명한 투자자를 대상으로 하여, 지금까지 시장에 살아남은 ‘진짜’ 고수들만을 최초로 모아 인터뷰했다. 이들의 실전투자대회 입상 기록을 모두 합하면 48회가 족히 넘으며, 우승만 총 22회 거두어 가히 ‘전설’이라 불러도 모자람이 없다. 투자를 통해 수십억에서 수백억에 이르는 자산을 일군 국가대표라 불릴만한 트레이더들의 생생한 이야기를 통해 그들이 어떻게 매매에 임하는지, 어떤 전략으로 접근하는지, 인간의 심리와 한계를 어떻게 극복하는지 등을 낱낱이 파헤쳐본다. 진정한 시장의 고수들의 투자 원칙과 노하우를 우리의 눈으로 직접 확인함으로써, 궁극적으로 나의 투자가 어떻게 ‘성공’에 이를 수 있을지 깊게 궁리하고 시행해 볼 좋은 기회이다."
3,돈은 빅테크로 흐른다 (가치투자 3.0 세대를 위한 명쾌한 테크주 투자법),https://search.shopping.naver.com/book/catalog/41340463619,https://shopping-phinf.pstatic.net/main_4134046/41340463619.20230919124324.jpg,"Seessel, Adam",17100,액티브,20230721,9791198335302,"“테슬라를 사고 싶지만 사지 못하는 투자자를 위한 책”
어닝파워 PER, BMP 템플릿 등 가치평가 및 분석 기준 제시

주가가 너무 비싸서, 기업 분석이 어려워서 등의 이유로 빅테크 투자 기회를 잡지 못하는 이들에게 쉽고 명쾌한 투자법을 제시하는 책. 월스트리트 베테랑 펀드매니저가 디지털시대에 맞게 보완한 가치평가 지표와 ‘좋은’ 테크주의 기준을 복잡한 계산식 없이 누구나 따라 할 수 있도록 체계화한 것이 특징이다.

저자가 ‘가치투자 3.0’으로 부르는 이 투자법은 ‘BMP(비즈니스, 경영진, 가격) 템플릿’, 기업의 잠재적인 이익 창출 능력을 계량화한 ‘어닝파워’, 일반회계원칙을 수정해 다시 계산한 ‘어닝파워 PER’이 핵심. 알파벳, 아마존 등 주요 빅테크의 BMP 템플릿 작성 과정, 어닝파워와 어닝파워 PER 산출 사례도 자세히 설명한다.

책 출간 당시 ‘이것이 과연 가치투자인가’를 놓고 월가에서 논쟁이 있었지만 〈월스트리트저널〉(2022.6.2.)은 “테크주에 돈이 있는 것은 분명한 사실”이라며 “이 책은 돈에 눈을 뜨게(eye for earnings) 한다”고 호평했다. 빌 애크먼, 조엘 그린블랫 등 전문가들도 이 책을 지지했다.

김학균 신영증권 리서치센터장은 “플랫폼기업을 평가하는 포괄적 기준으로 가치투자의 지평을 확장했다는 데 의미가 있다”고 평가했다. 윤지호 이베스트투자증권 리테일사업부 대표는 추천사에서 “변화하는 세상에 발맞춰 진화하는 기준을 제시한 애덤 시셀은 가치투자의 배교자가 아닌 계승자”라고 밝혔다."
4,캔들차트 매매법 (박스권에서 더 강한 주식매매전략),https://search.shopping.naver.com/book/catalog/32487152849,https://shopping-phinf.pstatic.net/main_3248715/32487152849.20230425161938.jpg,유지윤(터틀캠프),22500,북오션,20211210,9788967996475,"# 박스권에서 더 강한 차트매매법
# 장기 투자와 다른 단기투자용 차트분석
# 세력주 찾아내는 방법"
5,증권투자론,https://search.shopping.naver.com/book/catalog/32494082326,https://shopping-phinf.pstatic.net/main_3249408/32494082326.20230920071822.jpg,감형규^신용재^이의택^김영규,29440,율곡출판사,20220120,9791191812114,"본서가 세상에 첫 선을 보인 뒤 이번 제5판 개정이 이뤄지기까지 벌써 16년의 세월이 흘렀다. 그동안 변함없이 성원해 주신 독자 여러분께 진심으로 감사드린다. 개정작업을 할 때마다 저자들은 본서가 우리나라 증권산업의 발전에 기여할 유능한 인재 양성에 일조하였으면 하는 기대를 갖는다.
이번 개정판에서 저자들은 제4판의 골격은 그대로 유지하면서 다음과 같은 사항들을 추가 또는 보완하였다.

첫째, 증권투자의 전체적인 내용을 더욱 체계적으로 구성하여 건전한 증권투자의 길잡이로서 투자 관련 기초지식을 더욱 이해하기 쉽게 전달하고자 노력하였다.
둘째, 새로운 금융환경과 변경된 제도를 반영하여 각 장의 본문 내용은 물론 관련 그림과 표 등을 수정·보완하였다.
셋째, 증권투자 이론과 실무의 관련성을 부각시키고 현실 적용력을 기를 수 있도록 최근의 새로운 사례들을 추가하여 보완하였다.
넷째, 최대한 독자의 입장을 고려한 디자인과 편집 기술을 적용함으로써 본서의 내용을 시각적으로 편안하게 받아들일 수 있도록 배려하였다."
6,완벽한 재무제표 읽기 (한눈에 오를 주식만 골라내는 재무제표 완전 공략법),https://search.shopping.naver.com/book/catalog/32474282804,https://shopping-phinf.pstatic.net/main_3247428/32474282804.20221019140525.jpg,이강연,18000,비즈니스북스,20181030,9791162540480,"“어떤 상황에서도 누구나 연수익 15% 달성이 가능하다!”
IMF, 금융위기에도 흔들리지 않았던 수익률의 비결은 바로 재무제표 분석에 있다!
30년 기업분석의 끝판왕, 네이버 파워블로거 포카라의 완벽 재무제표 공략법

IMF, 금융위기에도 안정적으로 투자 수익을 올린 
기업분석 끝판왕이 알려주는 최고의 투자 비법!
전 세계적으로 주식시장이 급락하고 있다. 하루가 멀다 하고 쏟아져 나오는 경제 뉴스는 절망적이다. 미국의 금리 인상, 원유 가격 하락, 중국의 경제 성장 감소 환율 전쟁 등 어느 한 가지도 주식시장에 우호적이지 않다. 개인투자자는 이러한 변동에 더욱 취약할 수밖에 없다. 그런 상황을 뒷받침하듯 한 투자 사이트 조사에 따르면 개인투자자 가운데 꾸준히 수익을 내는 비율은 10명 중 한 명도 채 되지 않는다고 한다. 
이러한 시장 변동은 과거에도 계속 있었다. 1990년대 말 외환위기, 2008년 세계 금융위기 때도 주식시장은 격렬하게 흔들렸다. 그런 혼란기에도 꾸준하게 연수익 15% 이상을 기록하는 비법이 있었다면? 하루에 3,000명이 찾아와 투자 정보를 구하는 30년 재무제표 분석 전문가, 네이버 파워블로거 포카라 이강연은 재무제표 숫자 안에 바로 비법이 숨어 있다고 강조한다. 기본적인 재무제표 개념을 이해하고 숫자들의 연계성을 파악한다면 위기 속에서도 흔들리지 않는 알짜 기업만을 골라내 안정적으로 수익을 올릴 수 있다. 그리고 그러한 비법을 신간 《대한민국 주식투자자를 위한 완벽한 재무제표 읽기》에 모두 공개했다."
7,부자들은 이런 주식을 삽니다 (861% 수익을 올린 젊은 투자자 김현준의 실전 투자법),https://search.shopping.naver.com/book/catalog/32484549196,https://shopping-phinf.pstatic.net/main_3248454/32484549196.20230614072632.jpg,김현준,16200,위즈덤하우스,20210225,9791191425604,"주식으로 부자가 되려면 부자들은 어떤 주식을 사는지 먼저 알아야 한다!
부자들이 사는 주식의 비밀 공개!

〈유 퀴즈 온 더 블럭〉 〈정산회담〉으로 얼굴을 알린 젊은 부자 김현준 대표의 주식투자서. 861%라는 놀라운 수익률을 자랑하는 김현준 대표는 주식시장에서 승자가 되기 위해서는 부자의 시선으로 시장을 바라봐야 한다고 말한다. 우리나라 주식시장에서 돈을 잃는 투자자는 전부 주식 초보자다. 대박을 꿈꾸며 급등장에 들어왔지만 수익을 못 내고 있거나, 작은 이익에 흔들려 자주 매매하거나 시장은 보지 않고 그냥 무작정 우량주에 투자하는 사람이 전부 여기에 해당한다. 《부자들은 이런 주식을 삽니다》는 이러한 투자 관성을 버리고, 어떠한 상황에서도 잃지 않는 투자를 할 수 있는 비법을 ‘부자의 시선’으로 ‘부자의 마인드’로 말해주는 책이다."
8,"실전투자 절대지식 (실전투자대회 2회 우승, 120일 하향 매매기법, 갭 매매기법 전격 공개!, 개정증보판)",https://search.shopping.naver.com/book/catalog/32444045612,https://shopping-phinf.pstatic.net/main_3244404/32444045612.20230919123252.jpg,김형준,22500,이레미디어,20140125,9788991998872,"주식시장에서 최후의 승자가 되는 실전투자의 모든 것!

『실전투자 절대지식』은 실전투자대회에서 2회 우승을 포함하여 8회 연속 수상을 한 저자 김형준이 자신의 투자 비밀을 공개한다. 저자가 주식투자를 통해 매년 꾸준히 3억 원 이상을 현금화할 수 있는 비밀 무기는 바로 '120일 하향 매매법과 갭 매매법'이다. 우선, 주식투자를 시작하기 전 주식시장의 모습을 온전히 파악할 수 있도록 설명하고, 본격적으로 주식투자를 위한 기본적 분석과 기술적 분석을 알기 쉽게 설명한다. 차트를 보며 한눈에 파악할 수 있도록 모든 개념을 설명하며, 꼭 알아야 할 것들만 다룬다. 더불어 윌리엄 오닐과 워런 버핏이 실제 사용하는 기법들을 소개하며 투자 안목을 넓힐 수 있도록 도와준다."
9,실전 공매도 (공매도를 모르고 절대 주식투자 하지 마라!),https://search.shopping.naver.com/book/catalog/32473659116,https://shopping-phinf.pstatic.net/main_3247365/32473659116.20231119070839.jpg,김영옥(데이짱),16650,이레미디어,20200103,9791188279678,"당신의 돈을 호시탐탐 노리는 수많은 주식시장의 적을 물리칠 방법을 배워라
20여 년간 혼돈의 시장에서 살아남은 실전투자자의 생생한 노하우, 수익 계좌 인증

아직도 수많은 개미들은 주식투자가 정확히 무엇인지도 모른 채 주식시장에 뛰어들어 시장의 먹잇감이 되고 있다. 단 1~2초의 순간에 호가창은 폭풍이라도 일어난 듯 아래위로 마구 움직이며 전쟁을 벌이고, 실체를 알 수도 없는 프로그램 매매가 종목창을 깜빡깜빡 거리게 만들어 좌불안석 어쩔 줄을 모르는 투자자를 끊임없이 손실로 이끈다. 더 이상 떨어질 곳이 없는 바닥이라 생각하고 기껏 투자했더니 이제는 끝을 모르고 바닥으로 내리꽂아 버리는 주가를 보고 있노라면 심장이 덜컥 주저앉는다. 개미들은 왜 이런 일을 반복해서 당하는 것일까. 사방에 독사처럼 나의 돈을 노리고 있는 주식시장에서 적을 올바로 알고, 투자의 든든한 아군을 만들 필요가 있지 않을까? 한 번이라도 이러한 고민을 해본 사람이라면 《실전 공매도》가 정확한 해답을 제시한다.

우리는 이처럼 무시무시한 주식 시장에서 수많은 적과 상대하여 아직까지 살아남은 생존자의 말을 들을 필요가 있다. 실전투자대회에 참가하여 수차례 수상한 《실전 공매도》의 저자는 20여 년간 트레이딩을 성공적으로 해왔고, 자신의 매매(매수·공매도)와 수익을 직접 책에 인증했다. 그는 이 책에 필승 매수 기법을 포함하여 개인투자자가 직접 공매도(대주, 대차, CFD) 거래를 통하여 수익을 내는 기법을 국내 최초로 공개한다. 이를 통해 주가가 오를 때나 내릴 때나 모두 수익을 낼 수 있는 전략을 구사할 수 있다. 이를 활용해 이상적인 롱/쇼트 전략을 수립하는 것은 물론이고, 진짜 오르는 주식이 무엇인지, 어떻게 보유 주식의 수익을 극대화하고 청산하는 신호를 캐치할 수 있는지 배울 수 있다. 주식 초보도 누구나 이해할 수 있는 주식의 핵심과 매수기법을 가감 없이 공개한 것도 특징이다. 이제 《실전 공매도》를 통해 주식의 기본기를 튼튼하게 세우고 공매도 투자법을 배워 절대 수익을 올리는 일만 남았다."
0,부의 시작 (ETF만으로도 꼬박꼬박 연 40% 수익 내는 법),https://search.shopping.naver.com/book/catalog/32462848059,https://shopping-phinf.pstatic.net/main_3246284/32462848059.20230711115022.jpg,박민수,12420,길벗,20211003,9791165216955,"ㆍ 주식분야 베스트셀러 작가 박민수(샌드타이거샤크)의 신간! 
ㆍ ★ ETF로 연 40% 수익 내며 부의 사다리에 올라타는 법★ 
ㆍ 전기차/바이오 등 유망 산업을 완벽하게 분석해 미리미리 선점하자!
ㆍ 박민수 작가의 독자적 ETF 분석법인 ‘7단계 종목분석표’ 제공!"
1,엘리어트 파동이론 (시장의 움직임을 예측하는 단 하나의 열쇠),https://search.shopping.naver.com/book/catalog/32491421808,https://shopping-phinf.pstatic.net/main_3249142/32491421808.20230927071133.jpg,A. J. 프로스트^로버트 R. 프렉터 주니어^찰스 J. 콜린스,15210,이레미디어,20110707,9788991998568,"현존하는 최고의 주가예측도구, 엘리어트 파동이론!

『엘리어트 파동이론』은 엘리어트 파동이론에 대한 결정적 역작인 의 완역판으로, 현 시대의 투자자들이 엘리어트 파동이론의 기본부터 실전까지 모든 내용을 제대로 이해하고 활용할 수 있도록 구성했다. '엘리어트 파동이론'이란, 1934년 R. N. 엘리어트가 만든 주가예측도구로 수많은 데이터를 분석한 후 장기적 시장 예측은 물론 하루사이에 벌어지는 장중의 시간별 변동까지도 적중시킬 수 있다. 이 책은 파동이론의 수학적 기반을 제공하는 13세기의 수학자 레오나르도 피보나치가 발견한 피보나치 수열에 대한 역사적 배경에서 출발하여 원리와 의미, 주가 그리고 파동과의 관련성 등을 그림 자료와 함께 자세히 설명한다. 더불어 이론의 창시자 엘리어트의 목소리는 물론, 그의 이론을 가장 가까이에서 직접 연구하고 실험했던 동료들이 수많은 사례를 통해 확증했던 것들을 생생하게 담아 냈다."
2,나는 투자로 30년을 벌었다 (최상위로 올라가는 7가지 투자 습관),https://search.shopping.naver.com/book/catalog/32481390482,https://shopping-phinf.pstatic.net/main_3248139/32481390482.20230313182010.jpg,한정수,15120,토네이도,20210921,9791158512248,"카카오 뉴스 실시간 검색 1위
2021년을 달군 화제의 유튜브 〈세상학개론〉 첫 책

“왜 투자를 해야 하는가?
인생의 모든 것을 획기적으로 앞당길 수 있기 때문이다!“
서른 살에 사표를 쓰고 마침내
모두가 선망하는 ‘자유인’이 된 청년의 드라마틱한 투자 이야기

‘서른 살 평범한 직장인이 투자로 경제적 자유를 달성한 스토리’는 뜨거운 관심과 엄청난 반향을 불러일으켰다. 코로나19 이후 ‘투자’는 인생의 기본값이 되었다. 투자자와 투자하지 않은 사람의 차이가 더욱 극명해지면서 ‘벼락부자’와 ‘벼락거지’라는 말이 생겨났고, 일자리 불안 또한 가속화되었다. 당신이 만약 직장에서 일하지 않는 게 불안하다고 생각한다면, 일하지 않으면 생계를 유지할 자신이 없다는 뜻이다. 하지만 저자는 직장 밖의 삶이 위험한 것이 아니라 직장에 의존해야 살 수 있는 삶이 더 위험하다고 말한다. 
《나는 투자로 30년을 벌었다》는 3000만 원으로 30억을 만들 수 있었던 ‘원칙과 룰’을 ‘왜 투자자의 삶을 살아야 하는지-어떻게 투자를 해야 하는지-무엇에 투자해야 하는지’의 순서로 알려주는 책이다. 테크닉이 아닌, 원칙을 중심으로 확신을 갖고 집중 투자할 때 가장 빨리 부자가 될 수 있음을 결과로 생생하게 입증한다. 
투자를 하면서 멘탈이 흔들리는 진짜 이유는 무엇인지, 버블의 위험도는 어떻게 판단해야 하는지 등에 대해 놀라운 통찰력으로 조목조목 짚어주는 한편, 돈의 흐름과 부의 작동원리, 좋은 선택을 하고 불확실성을 이겨내는 법, 10배 오르는 종목을 찾는 법 등을 도표와 그림으로 쉽고도 강력하게 전한다. 
왜 어떤 사람들은 지속적으로 운을 잡고 어떤 사람들은 그러지 못할까? 왜 위기가 누군가에게는 기회가 될까? 무엇이 의사결정의 차이를 만들까? 투자 후 손해를 볼까봐 불안하다면, 세상의 큰 흐름을 읽는 법이 궁금하다면, 빠른 은퇴를 꿈꾼다면 이 책을 반드시 읽어보기 바란다. 어느새 불안 대신 ‘확신’으로, 두려움 대신 ‘전략’으로 부의 사다리에 오르고 있는 자신을 발견하게 될 것이다."
3,몸값 올리는 기업가치평가 실무 (해외주식 투자분석 사례),https://search.shopping.naver.com/book/catalog/32444870539,https://shopping-phinf.pstatic.net/main_3244487/32444870539.20230314070848.jpg,엄인수,19800,제이씨이너스,20211020,9791196263041,"이 책은 기업가치평가의 방법론 설명에서 멈추지 않고, 그 방법론을 기업분석이나 투자에 적용할 수 있도록 실무에 초점을 맞추고 있습니다. 가치평가 이론을 아는 것도 중요하지만 타깃기업의 상황에 맞는 적합한 방법론을 적용하는 것이 더 중요하기 때문입니다. 이를 위해 JP모건, 모건스탠리, UBS 등 글로벌 투자은행 애널리스트가 사용하는 방법론을 먼저 보여 줍니다. 그리고 독자들이 모든 이론을 쉽게 이해하고 적용하도록 애플, 테슬라, 아스트라제네카 등의 글로벌 기업의 분석사례를 보여 줍니다.
이 책은 두 파트로 구성되는데 첫 번째 파트는 기업가치평가, 두 번째 파트는 투자분석입니다. 현금흐름할인과 상대가치평가의 방법론을 벤처기업, 성장기업, 성숙기업, 적자기업에 적용하는 실무를 알려 준 다음 타깃기업 투자분석을 위한 절차와 투자의사결정의 기준을 설명합니다. 
저자의 투자분석 경험과 기업강의 노하우로 저술한 것이 이 책의 큰 장점입니다."
